index,ID,DATE,TO USER ACCOUNT,FROM USER ACCOUNT,REASON,SCORE 1,SCORE 2,SCORE 3,SCORE 4,DUPLICATE ID 1,DUPLICATE ID 2,DUPLICATE ID 3,DUPLICATE ID 4,DISMISSED 1,DISMISSED 2,DISMISSED 3,DISMISSED 4,QUANTIFIER 1 USERNAME,QUANTIFIER 2 USERNAME,QUANTIFIER 3 USERNAME,QUANTIFIER 4 USERNAME,AVG SCORE,SPREAD
340,6256d00b7d6ca6ad95bd5c21,2022-02-08T23:00:00.000Z,sem  🐝#0161,Mount Manu#3530,for being with the TEC since the beginning,5,0,1,0,,,,,False,False,False,False,bear100#9085,Usua◎ Silver#2618,boonjue.eth#7124,Tam2140#9361,3,5
762,6256d00b7d6ca6ad95bd5dc7,2022-02-12T23:00:00.000Z,Juankbell#7458,Mount Manu#3530,for coordinating Gravity on its way to decentralization,1,0,5,0,,6256d00b7d6ca6ad95bd5b67,,6256d00b7d6ca6ad95bd5d61,False,False,False,False,eduardovegap#0422,missgene#7773,Nuggan#5183,AmwFund#0979,2,5
195,6256d00b7d6ca6ad95bd5b90,2022-02-08T23:00:00.000Z,liviade#1387,Mount Manu#3530,for helping Sidcode understand how the system works and where it’s going,5,0,3,0,,,,,False,False,False,False,eduardovegap#0422,Usua◎ Silver#2618,enti#1546,Tam2140#9361,4,5
738,6256d00b7d6ca6ad95bd5daf,2022-02-12T23:00:00.000Z,"griff (💜, 💜)#8888",Mount Manu#3530,for joining the Stewards Council and participating in the discussion,0,0,1,5,,6256d00b7d6ca6ad95bd5b69,,,False,False,False,False,osycross(🦎🦎)#5943,missgene#7773,Nuggan#5183,EFRA#7972,2,5
1364,6256d00b7d6ca6ad95bd6021,2022-02-27T23:00:00.000Z,Zeptimus#3359,Zeptimus#3359,for a great transparency sync,5,0,3,5,,,,,False,False,False,False,GideonRo#3175,Usua◎ Silver#2618,enti#1546,AmwFund#0979,4,5
753,6256d00b7d6ca6ad95bd5dbe,2022-02-12T23:00:00.000Z,freshelle#9882,Mount Manu#3530,for helping Zepti with treasury management,5,0,0,0,,6256d00b7d6ca6ad95bd5cab,6256d00b7d6ca6ad95bd5b02,6256d00b7d6ca6ad95bd5b02,False,False,False,False,eduardovegap#0422,missgene#7773,enti#1546,innov8tor3#3988,2,5
752,6256d00b7d6ca6ad95bd5dbd,2022-02-12T23:00:00.000Z,liviade#1387,Mount Manu#3530,"for your enthusiasm in reward analysis, and for studying our community’s structure",5,0,3,0,,,,,False,False,False,False,eduardovegap#0422,Usua◎ Silver#2618,enti#1546,Tam2140#9361,4,5
344,6256d00b7d6ca6ad95bd5c25,2022-02-08T23:00:00.000Z,liviade#1387,Mount Manu#3530,for all the time and work you put into the Rewards Systems,5,0,0,0,,,6256d00b7d6ca6ad95bd5bcc,,False,False,False,False,eduardovegap#0422,Usua◎ Silver#2618,enti#1546,Tam2140#9361,2,5
743,6256d00b7d6ca6ad95bd5db4,2022-02-12T23:00:00.000Z,divine_comedian#5493,Mount Manu#3530,for your engagement in the proposal inverter,0,0,0,5,,6256d00b7d6ca6ad95bd5d96,6256d00b7d6ca6ad95bd5d96,,False,False,False,False,osycross(🦎🦎)#5943,liviade#1387,Nuggan#5183,tigeroid#2951,2,5
742,6256d00b7d6ca6ad95bd5db3,2022-02-12T23:00:00.000Z,Zeptimus#3359,Mount Manu#3530,for joining the Stewards Council and participating in the discussion,3,0,5,5,,,,,False,False,False,False,GideonRo#3175,Usua◎ Silver#2618,enti#1546,AmwFund#0979,4,5
1323,6256d00b7d6ca6ad95bd5ff8,2022-02-26T23:00:00.000Z,liviade#1387,Mount Manu#3530,for having met Bianca in ETHDenver,5,0,1,0,,,,,False,False,False,False,eduardovegap#0422,Usua◎ Silver#2618,enti#1546,Tam2140#9361,3,5
778,6256d00b7d6ca6ad95bd5dd7,2022-02-12T23:00:00.000Z,miguelb#5176,Mount Manu#3530,for attending last week's Community Call,1,1,5,0,,,,,False,False,False,True,eduardovegap#0422,lee0007#8152,acidlazzer#5796,tigeroid#2951,1,5
1139,6256d00b7d6ca6ad95bd5f40,2022-02-25T23:00:00.000Z,liviade#1387,Mount Manu#3530,for having done a great job at representing the TEC in ETHDenver,3,0,5,0,,,,,False,False,False,False,eduardovegap#0422,Usua◎ Silver#2618,enti#1546,Tam2140#9361,4,5
783,6256d00b7d6ca6ad95bd5ddc,2022-02-12T23:00:00.000Z,chuygarcia.eth#6692,Mount Manu#3530,for attending last week's Community Call,3,1,5,0,,,,,False,False,False,False,bear100#9085,missgene#7773,acidlazzer#5796,Tam2140#9361,3,5
36,6256d00b7d6ca6ad95bd5af1,2022-02-02T23:00:00.000Z,Juankbell#7458,bends#3537,for the great conversation on starting a Gravity group within Giveth,3,5,8,8,,,,,False,False,False,False,eduardovegap#0422,missgene#7773,Nuggan#5183,AmwFund#0979,6,5
829,6256d00b7d6ca6ad95bd5e0a,2022-02-16T23:00:00.000Z,durgadas#9280,Juankbell#7458,"for Tech, Philosophy and Humility!",8,5,5,3,,,,,False,False,False,False,GideonRo#3175,lee0007#8152,acidlazzer#5796,EFRA#7972,5,5
210,6256d00b7d6ca6ad95bd5b9f,2022-02-08T23:00:00.000Z,Vyvy-vi#5040,Mount Manu#3530,for being so excited about the next Labs sync,8,3,8,3,,,,,False,False,False,False,GideonRo#3175,liviade#1387,Nuggan#5183,EFRA#7972,5,5
107,6256d00b7d6ca6ad95bd5b38,2022-02-07T23:00:00.000Z,MarioRozo#3294,chuygarcia.eth#6692,for attending the Comms WG call today and sharing their thoughts about ongoing projects and situations,0,3,5,3,,,,,False,False,False,False,osycross(🦎🦎)#5943,liviade#1387,acidlazzer#5796,tigeroid#2951,3,5
318,6256d00b7d6ca6ad95bd5c0b,2022-02-08T23:00:00.000Z,liviade#1387,Mount Manu#3530,for your leadership and because without you there’d be no TEC,1,0,5,0,,,,,False,False,False,False,eduardovegap#0422,Usua◎ Silver#2618,enti#1546,Tam2140#9361,3,5
1366,6256d00b7d6ca6ad95bd6023,2022-02-27T23:00:00.000Z,chuygarcia.eth#6692,acidlazzer#5796,for attending the animation weekly sync and for all your support and feedback for the next reward systems video,3,3,5,0,,,,,False,False,False,False,bear100#9085,missgene#7773,acidlazzer#5796,Tam2140#9361,3,5
810,6256d00b7d6ca6ad95bd5df7,2022-02-14T23:00:00.000Z,eduardovegap#0422,liviade#1387,for jumping into the facilitation of soft gov meetings during ETH Denver! <3,13,8,8,13,,,,,False,False,False,False,Mike Brunt#0745,Zeptimus#3359,Nuggan#5183,tigeroid#2951,10,5
809,6256d00b7d6ca6ad95bd5df6,2022-02-14T23:00:00.000Z,bends#3537,liviade#1387,for jumping into the facilitation of soft gov meetings during ETH Denver! <3,8,8,8,13,,,,,False,False,False,False,Mike Brunt#0745,missgene#7773,Nuggan#5183,AmwFund#0979,9,5
802,6256d00b7d6ca6ad95bd5def,2022-02-14T23:00:00.000Z,MarioRozo#3294,chuygarcia.eth#6692,for attending a quick but productive Comms sync call <:TEC:835016327542210560>,0,1,5,1,,,,,False,False,False,False,osycross(🦎🦎)#5943,liviade#1387,acidlazzer#5796,tigeroid#2951,2,5
38,6256d00b7d6ca6ad95bd5af3,2022-02-02T23:00:00.000Z,liviade#1387,kishore#6162,for bringing in huge collaboration vibes and helping DeepSkills community with Praise trial 👐,3,0,5,0,,,,,False,False,False,False,eduardovegap#0422,Usua◎ Silver#2618,enti#1546,Tam2140#9361,4,5
324,6256d00b7d6ca6ad95bd5c11,2022-02-08T23:00:00.000Z,Zeptimus#3359,Mount Manu#3530,for your leadership and because without you there’d be no TEC,3,0,1,5,,,,,False,False,False,False,GideonRo#3175,Usua◎ Silver#2618,enti#1546,AmwFund#0979,3,5
202,6256d00b7d6ca6ad95bd5b97,2022-02-08T23:00:00.000Z,liviade#1387,Mount Manu#3530,"for how you present your work, which is beautiful to see and is one of the reasons why Pati admires you",5,0,3,0,,,,,False,False,False,False,eduardovegap#0422,Usua◎ Silver#2618,enti#1546,Tam2140#9361,4,5
791,6256d00b7d6ca6ad95bd5de4,2022-02-13T23:00:00.000Z,Mount Manu#3530,acidlazzer#5796,for attending the twitter weekly sync and for all your support behind the scenes 💓,3,5,8,8,,,,,False,False,False,False,bear100#9085,lee0007#8152,divine_comedian#5493,AmwFund#0979,6,5
790,6256d00b7d6ca6ad95bd5de3,2022-02-13T23:00:00.000Z,chuygarcia.eth#6692,acidlazzer#5796,for attending the twitter weekly sync and for all your support behind the scenes 💓,3,0,5,0,,6256d00b7d6ca6ad95bd5e56,,,False,False,False,False,bear100#9085,missgene#7773,acidlazzer#5796,Tam2140#9361,2,5
201,6256d00b7d6ca6ad95bd5b96,2022-02-08T23:00:00.000Z,ygg_anderson#4998,Mount Manu#3530,for the work and teachings in the Rewards System WG,13,8,13,8,,,,,False,False,False,False,Mike Brunt#0745,lee0007#8152,divine_comedian#5493,AmwFund#0979,10,5
788,6256d00b7d6ca6ad95bd5de1,2022-02-12T23:00:00.000Z,MarioRozo#3294,Mount Manu#3530,for attending last week's Community Call,0,1,5,1,,,,,False,False,False,False,osycross(🦎🦎)#5943,liviade#1387,acidlazzer#5796,tigeroid#2951,2,5
740,6256d00b7d6ca6ad95bd5db1,2022-02-12T23:00:00.000Z,Juankbell#7458,Mount Manu#3530,for joining the Stewards Council and participating in the discussion,1,0,1,5,,6256d00b7d6ca6ad95bd5b6d,,,False,False,False,False,eduardovegap#0422,missgene#7773,Nuggan#5183,AmwFund#0979,1,5
1156,6256d00b7d6ca6ad95bd5f51,2022-02-25T23:00:00.000Z,eduardovegap#0422,Mount Manu#3530,"for leading the TEC forward, both physically and virtually",8,13,8,8,,,,,False,False,False,False,Mike Brunt#0745,Zeptimus#3359,Nuggan#5183,tigeroid#2951,9,5
737,6256d00b7d6ca6ad95bd5dae,2022-02-12T23:00:00.000Z,Tam2140#9361,Mount Manu#3530,for joining the Stewards Council and participating in the discussion,5,0,1,1,,,,,False,False,False,False,Mike Brunt#0745,Usua◎ Silver#2618,boonjue.eth#7124,tigeroid#2951,2,5
680,6256d00b7d6ca6ad95bd5d75,2022-02-12T23:00:00.000Z,Rohit Malekar#7021,Mount Manu#3530,for joining our last Orientation call and for being new members of our community!,5,0,1,3,,,,,False,False,False,False,Mike Brunt#0745,Usua◎ Silver#2618,enti#1546,tigeroid#2951,3,5
351,6256d00b7d6ca6ad95bd5c2c,2022-02-08T23:00:00.000Z,Juankbell#7458,Mount Manu#3530,for being our community's Stewards,1,0,0,5,,6256d00b7d6ca6ad95bd5b6d,6256d00b7d6ca6ad95bd5bf7,,False,False,False,False,eduardovegap#0422,missgene#7773,Nuggan#5183,AmwFund#0979,1,5
370,6256d00b7d6ca6ad95bd5c3f,2022-02-08T23:00:00.000Z,Zeptimus#3359,Mount Manu#3530,for all of your contributions,3,0,1,5,,,,,False,False,False,False,GideonRo#3175,Usua◎ Silver#2618,enti#1546,AmwFund#0979,3,5
9,6256d00b7d6ca6ad95bd5ad6,2022-01-31T23:00:00.000Z,MarioRozo#3294,chuygarcia.eth#6692,for attending this week's Comms TEAM DAO sync <:TEC:835016327542210560>,0,1,5,1,,,,,False,False,False,False,osycross(🦎🦎)#5943,liviade#1387,acidlazzer#5796,tigeroid#2951,2,5
688,6256d00b7d6ca6ad95bd5d7d,2022-02-12T23:00:00.000Z,liviade#1387,Mount Manu#3530,for assisting to the event about conflict management for DAOs,5,0,5,0,,,,,False,False,False,False,eduardovegap#0422,Usua◎ Silver#2618,enti#1546,Tam2140#9361,5,5
1345,6256d00b7d6ca6ad95bd600e,2022-02-26T23:00:00.000Z,chuygarcia.eth#6692,Mount Manu#3530,for having attended our Feb. 24th Community Call!,3,1,5,0,,,,,False,False,False,False,bear100#9085,missgene#7773,acidlazzer#5796,Tam2140#9361,3,5
684,6256d00b7d6ca6ad95bd5d79,2022-02-12T23:00:00.000Z,innov8tor3#3988,Mount Manu#3530,for being so involved in the Gravity WG,3,0,5,0,,,,6256d00b7d6ca6ad95bd5d51,False,False,False,False,eduardovegap#0422,Usua◎ Silver#2618,divine_comedian#5493,EFRA#7972,3,5
1343,6256d00b7d6ca6ad95bd600c,2022-02-26T23:00:00.000Z,Guy James#3266,Mount Manu#3530,for having attended our Feb. 24th Community Call!,3,0,5,1,,,,,False,True,False,False,Mike Brunt#0745,lee0007#8152,acidlazzer#5796,EFRA#7972,2,5
682,6256d00b7d6ca6ad95bd5d77,2022-02-12T23:00:00.000Z,MorganicMovement 🍄#1085,Mount Manu#3530,"for being so open, wonderful, and for their insights of self-care",5,5,5,0,,,,,False,False,False,False,Mike Brunt#0745,lee0007#8152,acidlazzer#5796,Tam2140#9361,5,5
378,6256d00b7d6ca6ad95bd5c47,2022-02-08T23:00:00.000Z,chuygarcia.eth#6692,Mount Manu#3530,for attending our Jan. 27th Community Call,3,1,5,0,,,,,False,False,False,False,bear100#9085,missgene#7773,acidlazzer#5796,Tam2140#9361,3,5
699,6256d00b7d6ca6ad95bd5d88,2022-02-12T23:00:00.000Z,eduardovegap#0422,Mount Manu#3530,for heading up the Communitas group and staying persistent and committed throughout all kinds of dramas and technical issues,8,13,8,8,,,,,False,False,False,False,Mike Brunt#0745,Zeptimus#3359,Nuggan#5183,tigeroid#2951,9,5
677,6256d00b7d6ca6ad95bd5d72,2022-02-12T23:00:00.000Z,MargaritaDave#8576,Mount Manu#3530,for joining our last Orientation call and for being new members of our community!,1,0,1,5,,,,,False,False,False,False,eduardovegap#0422,Usua◎ Silver#2618,boonjue.eth#7124,innov8tor3#3988,2,5
676,6256d00b7d6ca6ad95bd5d71,2022-02-12T23:00:00.000Z,Thardust#6421,Mount Manu#3530,for joining our last Orientation call and for being new members of our community!,5,0,1,0,,,,,False,False,False,False,Mike Brunt#0745,Usua◎ Silver#2618,boonjue.eth#7124,Tam2140#9361,3,5
1335,6256d00b7d6ca6ad95bd6004,2022-02-26T23:00:00.000Z,mattyjee#8621,Mount Manu#3530,for having attended our Feb. 24th Community Call!,0,1,5,1,,,,,False,False,False,False,osycross(🦎🦎)#5943,liviade#1387,acidlazzer#5796,EFRA#7972,2,5
674,6256d00b7d6ca6ad95bd5d6f,2022-02-12T23:00:00.000Z,kylejensen.eth#420,Mount Manu#3530,for joining our last Orientation call and for being new members of our community!,5,1,1,0,,,,,False,False,False,False,Mike Brunt#0745,liviade#1387,enti#1546,Tam2140#9361,2,5
381,6256d00b7d6ca6ad95bd5c4a,2022-02-08T23:00:00.000Z,mattyjee#8621,Mount Manu#3530,for attending our Jan. 27th Community Call,0,1,5,1,,,,,False,False,False,False,osycross(🦎🦎)#5943,liviade#1387,acidlazzer#5796,EFRA#7972,2,5
1178,6256d00b7d6ca6ad95bd5f67,2022-02-25T23:00:00.000Z,karmaticacid#1218,Mount Manu#3530,for attending ETHDenver,3,0,5,0,,,,,False,True,False,False,bear100#9085,lee0007#8152,divine_comedian#5493,Tam2140#9361,2,5
1179,6256d00b7d6ca6ad95bd5f68,2022-02-25T23:00:00.000Z,"griff (💜, 💜)#8888",Mount Manu#3530,for attending ETHDenver,0,0,5,0,,6256d00b7d6ca6ad95bd5f0f,,6256d00b7d6ca6ad95bd5ff0,False,False,False,False,osycross(🦎🦎)#5943,missgene#7773,Nuggan#5183,EFRA#7972,2,5
666,6256d00b7d6ca6ad95bd5d67,2022-02-12T23:00:00.000Z,iviangita#3204,Mount Manu#3530,for continued assistance in the Transparency WG,1,1,0,5,,,6256d00b7d6ca6ad95bd5cb4,,False,False,False,False,eduardovegap#0422,lee0007#8152,enti#1546,innov8tor3#3988,1,5
1164,6256d00b7d6ca6ad95bd5f59,2022-02-25T23:00:00.000Z,Zeptimus#3359,Mount Manu#3530,for being very participative in the calls this week and for carrying forward the discussion while other Stewards were attending ETHDenver,5,0,0,0,,,6256d00b7d6ca6ad95bd5f43,6256d00b7d6ca6ad95bd5f15,False,False,False,False,GideonRo#3175,Usua◎ Silver#2618,enti#1546,AmwFund#0979,2,5
732,6256d00b7d6ca6ad95bd5da9,2022-02-12T23:00:00.000Z,durgadas#9280,Mount Manu#3530,"for jumping in with your honesty and your openness, always striving to improve our systems",5,5,5,0,,,,6256d00b7d6ca6ad95bd5da2,False,False,False,False,GideonRo#3175,lee0007#8152,acidlazzer#5796,EFRA#7972,3,5
704,6256d00b7d6ca6ad95bd5d8d,2022-02-12T23:00:00.000Z,akrtws (TE Academy)#4246,Mount Manu#3530,for your guidance and feedback supporting the Comms T.E.A.M. DAO,5,5,5,0,,,,6256d00b7d6ca6ad95bd5bc8,False,False,False,False,GideonRo#3175,lee0007#8152,boonjue.eth#7124,innov8tor3#3988,4,5
727,6256d00b7d6ca6ad95bd5da4,2022-02-12T23:00:00.000Z,Mount Manu#3530,Mount Manu#3530,"for always helping Bustavo with questions, pointing him in the right direction, and encouraging him with ideas",5,3,0,5,,,6256d00b7d6ca6ad95bd5b81,,False,False,False,False,bear100#9085,lee0007#8152,divine_comedian#5493,AmwFund#0979,3,5
358,6256d00b7d6ca6ad95bd5c33,2022-02-08T23:00:00.000Z,solsista#5370,Mount Manu#3530,for being our community's Stewards,0,0,5,0,,6256d00b7d6ca6ad95bd5b85,,6256d00b7d6ca6ad95bd5b74,False,False,False,False,osycross(🦎🦎)#5943,Zeptimus#3359,acidlazzer#5796,EFRA#7972,4,5
718,6256d00b7d6ca6ad95bd5d9b,2022-02-12T23:00:00.000Z,liviade#1387,Mount Manu#3530,for jumping in and leading the Rewards System sync this past week,1,0,5,0,,,,,False,False,False,False,eduardovegap#0422,Usua◎ Silver#2618,enti#1546,Tam2140#9361,3,5
368,6256d00b7d6ca6ad95bd5c3d,2022-02-08T23:00:00.000Z,ygg_anderson#4998,Mount Manu#3530,for all of your contributions,8,3,3,5,,,,,False,False,False,False,Mike Brunt#0745,lee0007#8152,divine_comedian#5493,AmwFund#0979,4,5
717,6256d00b7d6ca6ad95bd5d9a,2022-02-12T23:00:00.000Z,kristofer#1475,Mount Manu#3530,for taking care of your kids,0,1,5,0,,,,,False,False,False,False,osycross(🦎🦎)#5943,missgene#7773,acidlazzer#5796,Tam2140#9361,3,5
362,6256d00b7d6ca6ad95bd5c37,2022-02-08T23:00:00.000Z,liviade#1387,Mount Manu#3530,for being our very own culture subject-matter expert,1,0,5,0,,,,,False,False,False,False,eduardovegap#0422,Usua◎ Silver#2618,enti#1546,Tam2140#9361,3,5
726,6256d00b7d6ca6ad95bd5da3,2022-02-12T23:00:00.000Z,eduardovegap#0422,Mount Manu#3530,"for your openness, for always saying what you think, for being so welcoming, and for rewarding an open culture",13,8,8,8,,,,,False,False,False,False,Mike Brunt#0745,Zeptimus#3359,Nuggan#5183,tigeroid#2951,9,5
128,6256d00b7d6ca6ad95bd5b4d,2022-02-08T23:00:00.000Z,acidlazzer#5796,Mount Manu#3530,for the support they throw behind the Comms WG,3,8,3,5,,,,,False,False,False,False,GideonRo#3175,Zeptimus#3359,divine_comedian#5493,innov8tor3#3988,4,5
129,6256d00b7d6ca6ad95bd5b4e,2022-02-08T23:00:00.000Z,natesuits#4789,Mount Manu#3530,for the support they throw behind the Comms WG,1,5,5,0,,,,,False,False,False,False,GideonRo#3175,Zeptimus#3359,enti#1546,Tam2140#9361,3,5
729,6256d00b7d6ca6ad95bd5da6,2022-02-12T23:00:00.000Z,lEscanore#7764,Mount Manu#3530,for your dedication to the Translations team,0,5,5,0,,,,6256d00b7d6ca6ad95bd5c6a,False,False,False,False,osycross(🦎🦎)#5943,lee0007#8152,acidlazzer#5796,EFRA#7972,4,5
5,6256d00b7d6ca6ad95bd5ad2,2022-01-31T23:00:00.000Z,innov8tor3#3988,Juankbell#7458,for their active contribution and engagement on the development of Gravity,1,0,3,5,,,,,False,False,False,False,eduardovegap#0422,Usua◎ Silver#2618,divine_comedian#5493,EFRA#7972,3,5
190,6256d00b7d6ca6ad95bd5b8b,2022-02-08T23:00:00.000Z,Zeptimus#3359,Mount Manu#3530,for the parameter debates,3,0,3,5,,,,,False,False,False,False,GideonRo#3175,Usua◎ Silver#2618,enti#1546,AmwFund#0979,3,5
1035,6256d00b7d6ca6ad95bd5ed8,2022-02-22T23:00:00.000Z,Juankbell#7458,Jeremy&TheGospelOfChange#8201,for joining the Liberating Structures and Deep Democracy practice group sessions,1,5,1,1,,,,,False,False,False,False,eduardovegap#0422,missgene#7773,Nuggan#5183,AmwFund#0979,2,4
1372,6256d00b7d6ca6ad95bd6029,2022-02-27T23:00:00.000Z,SatoriD#2945,acidlazzer#5796,for attending the animation weekly sync and for all your support and feedback for the next reward systems video,1,5,5,3,,,,,False,False,False,False,eduardovegap#0422,lee0007#8152,divine_comedian#5493,tigeroid#2951,3,4
1235,6256d00b7d6ca6ad95bd5fa0,2022-02-25T23:00:00.000Z,Juankbell#7458,Mount Manu#3530,for supporting the Comms WG as well,1,5,1,5,,,,,False,False,False,False,eduardovegap#0422,missgene#7773,Nuggan#5183,AmwFund#0979,3,4
1038,6256d00b7d6ca6ad95bd5edb,2022-02-22T23:00:00.000Z,durgadas#9280,Jeremy&TheGospelOfChange#8201,for joining the Liberating Structures and Deep Democracy practice group sessions,1,1,5,5,,,,,False,False,False,False,GideonRo#3175,lee0007#8152,acidlazzer#5796,EFRA#7972,3,4
13,6256d00b7d6ca6ad95bd5ada,2022-01-31T23:00:00.000Z,durgadas#9280,chuygarcia.eth#6692,for attending this week's Comms TEAM DAO sync <:TEC:835016327542210560>,1,1,5,3,,,,,False,False,False,False,GideonRo#3175,lee0007#8152,acidlazzer#5796,EFRA#7972,2,4
1062,6256d00b7d6ca6ad95bd5ef3,2022-02-22T23:00:00.000Z,Nuggan#5183,kristofer#1475,for joining todays Rewards WG call!,3,1,5,3,,,,,False,False,False,False,Mike Brunt#0745,liviade#1387,acidlazzer#5796,EFRA#7972,3,4
1263,6256d00b7d6ca6ad95bd5fbc,2022-02-25T23:00:00.000Z,Juankbell#7458,Mount Manu#3530,for being welcoming in the Orientation call last week,1,1,1,5,,,,,False,False,False,False,eduardovegap#0422,missgene#7773,Nuggan#5183,AmwFund#0979,2,4
1193,6256d00b7d6ca6ad95bd5f76,2022-02-25T23:00:00.000Z,alantv#0964,Mount Manu#3530,for being on the animation & video production T.E.A.M.,3,5,1,3,,,,,False,False,False,False,eduardovegap#0422,lee0007#8152,boonjue.eth#7124,tigeroid#2951,3,4
1018,6256d00b7d6ca6ad95bd5ec7,2022-02-20T23:00:00.000Z,EFRA#7972,acidlazzer#5796,for joining the animation weekly sync,5,1,1,1,,,,,False,False,False,False,Mike Brunt#0745,lee0007#8152,divine_comedian#5493,AmwFund#0979,2,4
18,6256d00b7d6ca6ad95bd5adf,2022-01-31T23:00:00.000Z,AmwFund#0979,chuygarcia.eth#6692,for attending this week's Comms TEAM DAO sync <:TEC:835016327542210560>,3,1,5,1,,,,,False,False,False,False,Mike Brunt#0745,Zeptimus#3359,acidlazzer#5796,innov8tor3#3988,2,4
1078,6256d00b7d6ca6ad95bd5f03,2022-02-23T23:00:00.000Z,Juankbell#7458,bends#3537,for sharing perspective on soft gov,1,5,3,3,,,,,False,False,False,False,eduardovegap#0422,missgene#7773,Nuggan#5183,AmwFund#0979,3,4
110,6256d00b7d6ca6ad95bd5b3b,2022-02-07T23:00:00.000Z,durgadas#9280,chuygarcia.eth#6692,for attending the Comms WG call today and sharing their thoughts about ongoing projects and situations,1,1,5,3,,,,,False,False,False,False,GideonRo#3175,lee0007#8152,acidlazzer#5796,EFRA#7972,2,4
936,6256d00b7d6ca6ad95bd5e75,2022-02-18T23:00:00.000Z,durgadas#9280,Mount Manu#3530,for welcoming Gaian into the community,3,1,5,3,,,,,False,False,False,False,GideonRo#3175,lee0007#8152,acidlazzer#5796,EFRA#7972,3,4
973,6256d00b7d6ca6ad95bd5e9a,2022-02-19T23:00:00.000Z,enti#1546,Mount Manu#3530,for showing interest in contributing to documentation,5,1,3,3,,,,,False,False,False,False,Mike Brunt#0745,liviade#1387,divine_comedian#5493,innov8tor3#3988,3,4
580,6256d00b7d6ca6ad95bd5d11,2022-02-09T23:00:00.000Z,durgadas#9280,Ratio13#0578,for his discussion after the weekly TWG meeting.,1,3,5,5,,,,,False,False,False,False,GideonRo#3175,lee0007#8152,acidlazzer#5796,EFRA#7972,3,4
584,6256d00b7d6ca6ad95bd5d15,2022-02-09T23:00:00.000Z,Juankbell#7458,liviade#1387,for joining soft gov this week!,1,5,1,1,,,,,False,False,False,False,eduardovegap#0422,missgene#7773,Nuggan#5183,AmwFund#0979,2,4
585,6256d00b7d6ca6ad95bd5d16,2022-02-09T23:00:00.000Z,durgadas#9280,liviade#1387,for joining soft gov this week!,1,1,5,3,,,,,False,False,False,False,GideonRo#3175,lee0007#8152,acidlazzer#5796,EFRA#7972,2,4
586,6256d00b7d6ca6ad95bd5d17,2022-02-09T23:00:00.000Z,bends#3537,liviade#1387,for joining soft gov this week!,3,5,1,1,,,,,False,False,False,False,Mike Brunt#0745,missgene#7773,Nuggan#5183,AmwFund#0979,2,4
588,6256d00b7d6ca6ad95bd5d19,2022-02-09T23:00:00.000Z,Annn3#3538,liviade#1387,for joining soft gov this week!,3,1,5,1,,,,,False,False,False,False,eduardovegap#0422,lee0007#8152,acidlazzer#5796,AmwFund#0979,2,4
659,6256d00b7d6ca6ad95bd5d60,2022-02-12T23:00:00.000Z,Mount Manu#3530,Mount Manu#3530,for always being there and for all the good vibez,5,3,1,3,,,,,False,False,False,False,bear100#9085,lee0007#8152,divine_comedian#5493,AmwFund#0979,3,4
669,6256d00b7d6ca6ad95bd5d6a,2022-02-12T23:00:00.000Z,Ale borda#2295,Mount Manu#3530,for joining our last Orientation call and for being new members of our community!,5,1,1,3,,,,,False,False,False,False,Mike Brunt#0745,liviade#1387,Nuggan#5183,EFRA#7972,2,4
671,6256d00b7d6ca6ad95bd5d6c,2022-02-12T23:00:00.000Z,DavidRM#8303,Mount Manu#3530,for joining our last Orientation call and for being new members of our community!,5,1,5,3,,,,,False,False,False,False,Mike Brunt#0745,missgene#7773,acidlazzer#5796,EFRA#7972,3,4
672,6256d00b7d6ca6ad95bd5d6d,2022-02-12T23:00:00.000Z,enti#1546,Mount Manu#3530,for joining our last Orientation call and for being new members of our community!,3,1,3,5,,,,,False,False,False,False,Mike Brunt#0745,liviade#1387,divine_comedian#5493,innov8tor3#3988,3,4
678,6256d00b7d6ca6ad95bd5d73,2022-02-12T23:00:00.000Z,monicazng#7334,Mount Manu#3530,for joining our last Orientation call and for being new members of our community!,5,1,1,5,,,,,False,False,False,False,Mike Brunt#0745,lee0007#8152,boonjue.eth#7124,innov8tor3#3988,3,4
81,6256d00b7d6ca6ad95bd5b1e,2022-02-06T23:00:00.000Z,Mount Manu#3530,acidlazzer#5796,for joining the Twitter Weekly Sync and giving tweet ideas for this week,3,1,1,5,,,,,False,False,False,False,bear100#9085,lee0007#8152,divine_comedian#5493,AmwFund#0979,2,4
710,6256d00b7d6ca6ad95bd5d93,2022-02-12T23:00:00.000Z,Mount Manu#3530,Mount Manu#3530,for your support through tough times,3,3,1,5,,,,,False,False,False,False,bear100#9085,lee0007#8152,divine_comedian#5493,AmwFund#0979,3,4
88,6256d00b7d6ca6ad95bd5b25,2022-02-06T23:00:00.000Z,Mount Manu#3530,acidlazzer#5796,for joining the Animation TEAM weekly sync and discuss about the Comms TEAM DAO funding proposal,3,1,3,5,,,,,False,False,False,False,bear100#9085,lee0007#8152,divine_comedian#5493,AmwFund#0979,3,4
90,6256d00b7d6ca6ad95bd5b27,2022-02-06T23:00:00.000Z,johnjonas#2307,acidlazzer#5796,for joining the Animation TEAM weekly sync and discuss about the Comms TEAM DAO funding proposal,5,1,5,1,,,,,False,False,False,False,Mike Brunt#0745,Zeptimus#3359,divine_comedian#5493,AmwFund#0979,3,4
741,6256d00b7d6ca6ad95bd5db2,2022-02-12T23:00:00.000Z,durgadas#9280,Mount Manu#3530,for joining the Stewards Council and participating in the discussion,1,5,5,5,,,,,False,False,False,False,GideonRo#3175,lee0007#8152,acidlazzer#5796,EFRA#7972,4,4
759,6256d00b7d6ca6ad95bd5dc4,2022-02-12T23:00:00.000Z,iviangita#3204,Mount Manu#3530,for staying up until very late to engage with the Commons,5,1,5,3,,,,,False,False,False,False,eduardovegap#0422,lee0007#8152,enti#1546,innov8tor3#3988,3,4
363,6256d00b7d6ca6ad95bd5c38,2022-02-08T23:00:00.000Z,Juankbell#7458,Mount Manu#3530,for all of your contributions,1,5,3,5,,,,,False,False,False,False,eduardovegap#0422,missgene#7773,Nuggan#5183,AmwFund#0979,3,4
784,6256d00b7d6ca6ad95bd5ddd,2022-02-12T23:00:00.000Z,Nuggan#5183,Mount Manu#3530,for attending last week's Community Call,3,1,5,1,,,,,False,False,False,False,Mike Brunt#0745,liviade#1387,acidlazzer#5796,EFRA#7972,2,4
876,6256d00b7d6ca6ad95bd5e39,2022-02-17T23:00:00.000Z,iviangita#3204,Zeptimus#3359,for creating an epic for the audit 😄,1,5,3,5,,,,,False,False,False,False,eduardovegap#0422,lee0007#8152,enti#1546,innov8tor3#3988,3,4
111,6256d00b7d6ca6ad95bd5b3c,2022-02-07T23:00:00.000Z,David Miller#4521,chuygarcia.eth#6692,for attending the Comms WG call today and sharing their thoughts about ongoing projects and situations,5,1,5,3,,,,,False,False,False,False,bear100#9085,Zeptimus#3359,divine_comedian#5493,tigeroid#2951,3,4
