index,ID,DATE,TO USER ACCOUNT,FROM USER ACCOUNT,REASON,SCORE 1,SCORE 2,SCORE 3,SCORE 4,DUPLICATE ID 1,DUPLICATE ID 2,DUPLICATE ID 3,DUPLICATE ID 4,DISMISSED 1,DISMISSED 2,DISMISSED 3,DISMISSED 4,QUANTIFIER 1 USERNAME,QUANTIFIER 2 USERNAME,QUANTIFIER 3 USERNAME,QUANTIFIER 4 USERNAME,AVG SCORE,SPREAD
476,6256d00b7d6ca6ad95bd5ca9,2022-02-08T23:00:00.000Z,liviade#1387,Mount Manu#3530,for the coordination to set up the multi-sig,13,0,3,0,,,,,False,False,False,False,eduardovegap#0422,Usua◎ Silver#2618,enti#1546,Tam2140#9361,8,13
525,6256d00b7d6ca6ad95bd5cda,2022-02-09T23:00:00.000Z,johnjonas#2307,Mount Manu#3530,for your work in the Animation & Video Production team,0,8,13,0,6256d00b7d6ca6ad95bd5cb7,,,6256d00b7d6ca6ad95bd5cb7,False,False,False,False,Mike Brunt#0745,Zeptimus#3359,divine_comedian#5493,AmwFund#0979,5,13
1243,6256d00b7d6ca6ad95bd5fa8,2022-02-25T23:00:00.000Z,divine_comedian#5493,Mount Manu#3530,for coming to the DAOist event in Mexico,0,13,5,8,,,,,False,False,False,False,osycross(🦎🦎)#5943,liviade#1387,Nuggan#5183,tigeroid#2951,8,13
1259,6256d00b7d6ca6ad95bd5fb8,2022-02-25T23:00:00.000Z,Jeremy&TheGospelOfChange#8201,Mount Manu#3530,for the practice sessions that you’ve been hosting out for the Gravity WG,0,0,13,0,6256d00b7d6ca6ad95bd5ed5,,,6256d00b7d6ca6ad95bd5ed5,False,True,False,False,GideonRo#3175,lee0007#8152,divine_comedian#5493,AmwFund#0979,4,13
554,6256d00b7d6ca6ad95bd5cf7,2022-02-09T23:00:00.000Z,Suga#8514,liviade#1387,"for engaging in soft gov again, it's great to have her back!",8,13,5,0,,,,,False,False,False,False,eduardovegap#0422,missgene#7773,acidlazzer#5796,Tam2140#9361,8,13
577,6256d00b7d6ca6ad95bd5d0e,2022-02-09T23:00:00.000Z,Tam2140#9361,Ratio13#0578,"for the one on one today, for the Stewards Council call for continued support, direction in the TWG.",0,0,8,13,6256d00b7d6ca6ad95bd5cd8,,,,False,False,False,False,Mike Brunt#0745,Usua◎ Silver#2618,boonjue.eth#7124,tigeroid#2951,7,13
665,6256d00b7d6ca6ad95bd5d66,2022-02-12T23:00:00.000Z,Zeptimus#3359,Mount Manu#3530,for continued assistance in the Transparency WG,13,0,0,0,,,6256d00b7d6ca6ad95bd5cb3,6256d00b7d6ca6ad95bd5cb3,False,False,False,False,GideonRo#3175,Usua◎ Silver#2618,enti#1546,AmwFund#0979,4,13
565,6256d00b7d6ca6ad95bd5d02,2022-02-09T23:00:00.000Z,divine_comedian#5493,liviade#1387,for constant progress on the reward system's!,0,0,8,13,,6256d00b7d6ca6ad95bd5bcd,,,False,False,False,False,osycross(🦎🦎)#5943,liviade#1387,Nuggan#5183,tigeroid#2951,8,13
562,6256d00b7d6ca6ad95bd5cff,2022-02-09T23:00:00.000Z,Nebs#2035,liviade#1387,for constant progress on the reward system's!,5,0,13,13,,,,,False,False,False,False,GideonRo#3175,Usua◎ Silver#2618,boonjue.eth#7124,tigeroid#2951,10,13
1227,6256d00b7d6ca6ad95bd5f98,2022-02-25T23:00:00.000Z,"griff (💜, 💜)#8888",Mount Manu#3530,for your amazing talks at ETHDenver,0,0,13,0,,,,6256d00b7d6ca6ad95bd5fd4,False,False,False,False,osycross(🦎🦎)#5943,missgene#7773,Nuggan#5183,EFRA#7972,7,13
558,6256d00b7d6ca6ad95bd5cfb,2022-02-09T23:00:00.000Z,solsista#5370,liviade#1387,for her leadership in the omega wg,0,13,8,8,,,,,False,False,False,False,osycross(🦎🦎)#5943,Zeptimus#3359,acidlazzer#5796,EFRA#7972,9,13
557,6256d00b7d6ca6ad95bd5cfa,2022-02-09T23:00:00.000Z,eugene#1706,liviade#1387,for having me in his podcast to talk about culture with Seth Frey 🙏🏽,3,13,8,0,,,,,False,False,False,False,eduardovegap#0422,missgene#7773,Nuggan#5183,Tam2140#9361,8,13
164,6256d00b7d6ca6ad95bd5b71,2022-02-08T23:00:00.000Z,Vyvy-vi#5040,Mount Manu#3530,for your work and commitment as Stewards,13,8,8,0,,,,6256d00b7d6ca6ad95bd5bfb,False,False,False,False,GideonRo#3175,liviade#1387,Nuggan#5183,EFRA#7972,7,13
1217,6256d00b7d6ca6ad95bd5f8e,2022-02-25T23:00:00.000Z,pat.zip (TE Academy)#5266,Mount Manu#3530,for the work you’ve been doing with TE Academy around communications,0,13,5,0,,,,6256d00b7d6ca6ad95bd5ed2,False,False,False,False,osycross(🦎🦎)#5943,Zeptimus#3359,acidlazzer#5796,EFRA#7972,6,13
593,6256d00b7d6ca6ad95bd5d1e,2022-02-09T23:00:00.000Z,Zeptimus#3359,liviade#1387,for hosting a great feedback call for the quant process!!,13,0,5,13,,,,,False,False,False,False,GideonRo#3175,Usua◎ Silver#2618,enti#1546,AmwFund#0979,10,13
600,6256d00b7d6ca6ad95bd5d25,2022-02-09T23:00:00.000Z,enti#1546,Zeptimus#3359,for sharing feedback and participating in the Praise insights and quantification feedback call,8,8,21,8,,,,,False,False,False,False,Mike Brunt#0745,liviade#1387,divine_comedian#5493,innov8tor3#3988,11,13
148,6256d00b7d6ca6ad95bd5b61,2022-02-08T23:00:00.000Z,natesuits#4789,Mount Manu#3530,for sharing resources with other new members of our community and helping them find their footing as contributors,8,13,5,0,,,,,False,False,False,False,GideonRo#3175,Zeptimus#3359,enti#1546,Tam2140#9361,8,13
553,6256d00b7d6ca6ad95bd5cf6,2022-02-09T23:00:00.000Z,sidcode#1729,liviade#1387,for being a wizard of great connections! thanks for all the bridges you are building 💛,0,0,0,13,6256d00b7d6ca6ad95bd5c87,6256d00b7d6ca6ad95bd5c87,6256d00b7d6ca6ad95bd5c87,,False,False,False,False,bear100#9085,Zeptimus#3359,Nuggan#5183,tigeroid#2951,4,13
552,6256d00b7d6ca6ad95bd5cf5,2022-02-09T23:00:00.000Z,Tam2140#9361,liviade#1387,for quickly including the power topic in the council meeting today,13,0,5,5,,,,,False,False,False,False,Mike Brunt#0745,Usua◎ Silver#2618,boonjue.eth#7124,tigeroid#2951,7,13
603,6256d00b7d6ca6ad95bd5d28,2022-02-09T23:00:00.000Z,mateodaza#3156,kristofer#1475,for facilitating a great source cred params session!,8,0,13,5,,,,,False,False,False,False,eduardovegap#0422,Usua◎ Silver#2618,Nuggan#5183,EFRA#7972,8,13
550,6256d00b7d6ca6ad95bd5cf3,2022-02-09T23:00:00.000Z,natesuits#4789,liviade#1387,for sharing his thoughts on power in the TEC with me,13,13,5,0,,,,,False,False,False,False,GideonRo#3175,Zeptimus#3359,enti#1546,Tam2140#9361,10,13
1241,6256d00b7d6ca6ad95bd5fa6,2022-02-25T23:00:00.000Z,"griff (💜, 💜)#8888",Mount Manu#3530,for coming to the DAOist event in Mexico,0,8,8,13,,,,,False,False,False,False,osycross(🦎🦎)#5943,missgene#7773,Nuggan#5183,EFRA#7972,9,13
1206,6256d00b7d6ca6ad95bd5f83,2022-02-25T23:00:00.000Z,Ratio13#0578,Mount Manu#3530,for attending our last Community Call event,0,13,1,0,,,,,False,False,False,False,osycross(🦎🦎)#5943,Zeptimus#3359,divine_comedian#5493,Tam2140#9361,7,13
581,6256d00b7d6ca6ad95bd5d12,2022-02-09T23:00:00.000Z,bends#3537,liviade#1387,for volunteering to update the decision making post with the latest params!,21,13,13,8,,,,,False,False,False,False,Mike Brunt#0745,missgene#7773,Nuggan#5183,AmwFund#0979,13,13
1255,6256d00b7d6ca6ad95bd5fb4,2022-02-25T23:00:00.000Z,GideonRo#3175,Mount Manu#3530,for pushing forward the agenda of our community,0,13,1,13,,,,,False,False,False,False,osycross(🦎🦎)#5943,Zeptimus#3359,boonjue.eth#7124,tigeroid#2951,9,13
1185,6256d00b7d6ca6ad95bd5f6e,2022-02-25T23:00:00.000Z,natesuits#4789,Mount Manu#3530,"for taking care of all the Stewards call, including the past Community Call",5,13,5,0,,,,,False,False,False,False,GideonRo#3175,Zeptimus#3359,enti#1546,Tam2140#9361,7,13
1257,6256d00b7d6ca6ad95bd5fb6,2022-02-25T23:00:00.000Z,natesuits#4789,Mount Manu#3530,for coordinating all the work we did this past week,8,13,8,0,,,,,False,False,False,False,GideonRo#3175,Zeptimus#3359,enti#1546,Tam2140#9361,9,13
1181,6256d00b7d6ca6ad95bd5f6a,2022-02-25T23:00:00.000Z,BiancaGadelha#2667,Mount Manu#3530,for attending ETHDenver,0,13,5,8,,,,,False,False,False,False,osycross(🦎🦎)#5943,Zeptimus#3359,acidlazzer#5796,innov8tor3#3988,8,13
238,6256d00b7d6ca6ad95bd5bbb,2022-02-08T23:00:00.000Z,kristofer#1475,Mount Manu#3530,for all the work done around our Praise system,0,13,8,0,,,,,False,False,False,False,osycross(🦎🦎)#5943,missgene#7773,acidlazzer#5796,Tam2140#9361,10,13
23,6256d00b7d6ca6ad95bd5ae4,2022-02-01T23:00:00.000Z,mateodaza#3156,mateodaza#3156,for joining a hack session on the pollen bot today,5,0,13,5,,,,,False,False,False,False,eduardovegap#0422,Usua◎ Silver#2618,Nuggan#5183,EFRA#7972,7,13
24,6256d00b7d6ca6ad95bd5ae5,2022-02-01T23:00:00.000Z,chuygarcia.eth#6692,vangelis#4349,"for helping me understand the different stakeholders, their roles and funding proposals",5,13,5,0,,,,,False,False,False,False,bear100#9085,missgene#7773,acidlazzer#5796,Tam2140#9361,7,13
890,6256d00b7d6ca6ad95bd5e47,2022-02-18T23:00:00.000Z,Ratio13#0578,Mount Manu#3530,for joining 0mega calls and engaging in its discussions,0,8,13,0,,,,,False,False,False,False,osycross(🦎🦎)#5943,Zeptimus#3359,divine_comedian#5493,Tam2140#9361,10,13
887,6256d00b7d6ca6ad95bd5e44,2022-02-18T23:00:00.000Z,Letty#5399,Mount Manu#3530,for very interesting discussions on the 0mega channel,3,0,3,13,,,,,False,False,False,False,eduardovegap#0422,Usua◎ Silver#2618,boonjue.eth#7124,tigeroid#2951,6,13
1081,6256d00b7d6ca6ad95bd5f06,2022-02-23T23:00:00.000Z,Leen#8610,bends#3537,for leading the liberating structures practice group and for allowing the time to utilize the excercise,0,0,5,13,6256d00b7d6ca6ad95bd5e02,,,,False,False,False,False,Mike Brunt#0745,Usua◎ Silver#2618,enti#1546,EFRA#7972,6,13
882,6256d00b7d6ca6ad95bd5e3f,2022-02-18T23:00:00.000Z,dough-naut#9755,Mount Manu#3530,"for finishing the Dune Analytics chart (it’s super great, thank you!)",13,0,5,13,,6256d00b7d6ca6ad95bd5c1a,,,False,False,False,False,eduardovegap#0422,missgene#7773,acidlazzer#5796,EFRA#7972,8,13
1086,6256d00b7d6ca6ad95bd5f0b,2022-02-23T23:00:00.000Z,Zeptimus#3359,Ratio13#0578,for their continued involvement in TEC and Transparency WG. for the continued support for leading Legal WG during ETH Denver and continued support in Transparency. & for the awesome Gravity workshop. Lastly all those representing TEC at ETH Denver.,13,0,5,13,,,,,False,False,False,False,GideonRo#3175,Usua◎ Silver#2618,enti#1546,AmwFund#0979,10,13
97,6256d00b7d6ca6ad95bd5b2e,2022-02-07T23:00:00.000Z,"griff (💜, 💜)#8888",Tam2140#9361,for giving feedback on this talk as it comes together. Your insights are simply invaluable. 🙏🏽,0,5,8,13,,,,,False,False,False,False,osycross(🦎🦎)#5943,missgene#7773,Nuggan#5183,EFRA#7972,8,13
99,6256d00b7d6ca6ad95bd5b30,2022-02-07T23:00:00.000Z,Mettodo#7010,Zeptimus#3359,for participating in the doodle for Praise insights and quantification feedback!,0,3,13,8,,,,,False,False,False,False,osycross(🦎🦎)#5943,liviade#1387,Nuggan#5183,innov8tor3#3988,8,13
863,6256d00b7d6ca6ad95bd5e2c,2022-02-17T23:00:00.000Z,enti#1546,freshelle#9882,for engaging in discussion on the TE Commons Forum (https://forum.tecommons.org) the past week. Thank you for helping our Token Engineering Commons community share and learn! 💪🙏,13,0,0,8,,,,,False,True,True,False,Mike Brunt#0745,liviade#1387,divine_comedian#5493,innov8tor3#3988,5,13
1095,6256d00b7d6ca6ad95bd5f14,2022-02-23T23:00:00.000Z,natesuits#4789,enti#1546,"for their participation on ETH Denver, @natesuits, and @Mount Manu for their great commitment to the community, leading calls and helping everyone around. Also for being wherever needed.",13,8,3,0,,,,,False,False,False,False,GideonRo#3175,Zeptimus#3359,enti#1546,Tam2140#9361,8,13
1096,6256d00b7d6ca6ad95bd5f15,2022-02-23T23:00:00.000Z,Zeptimus#3359,enti#1546,"for their participation on ETH Denver, @natesuits, and @Mount Manu for their great commitment to the community, leading calls and helping everyone around. Also for being wherever needed.",0,0,3,13,6256d00b7d6ca6ad95bd5f0b,,,,False,False,False,False,GideonRo#3175,Usua◎ Silver#2618,enti#1546,AmwFund#0979,5,13
1098,6256d00b7d6ca6ad95bd5f17,2022-02-23T23:00:00.000Z,Ratio13#0578,enti#1546,"for their participation on ETH Denver, @natesuits, and @Mount Manu for their great commitment to the community, leading calls and helping everyone around. Also for being wherever needed.",0,13,8,0,,,,,False,False,False,False,osycross(🦎🦎)#5943,Zeptimus#3359,divine_comedian#5493,Tam2140#9361,10,13
43,6256d00b7d6ca6ad95bd5af8,2022-02-02T23:00:00.000Z,acidlazzer#5796,Juankbell#7458,for his great work supporting in Twitter planning an posting!,21,21,34,34,,,,,False,False,False,False,GideonRo#3175,Zeptimus#3359,divine_comedian#5493,innov8tor3#3988,27,13
1105,6256d00b7d6ca6ad95bd5f1e,2022-02-24T23:00:00.000Z,natesuits#4789,Guy James#3266,for welcoming me to TEC and for onboarding me to the Praise system 🙏,5,13,3,0,,,,,False,False,False,False,GideonRo#3175,Zeptimus#3359,enti#1546,Tam2140#9361,7,13
844,6256d00b7d6ca6ad95bd5e19,2022-02-17T23:00:00.000Z,pat.zip (TE Academy)#5266,akrtws (TE Academy)#4246,"for an amazing job in structuring comms for TEC x TEA, spreading the word and supporting each other on marketing activities. Thank you!",0,13,5,8,,,,,False,False,False,False,osycross(🦎🦎)#5943,Zeptimus#3359,acidlazzer#5796,EFRA#7972,8,13
840,6256d00b7d6ca6ad95bd5e15,2022-02-16T23:00:00.000Z,angieberryberry#9822,pat.zip (TE Academy)#5266,for the creativity with memes and for being so effective in promoting awesome presentations from TEA and TEC!,0,5,5,13,,,,,False,False,False,False,osycross(🦎🦎)#5943,lee0007#8152,enti#1546,innov8tor3#3988,7,13
839,6256d00b7d6ca6ad95bd5e14,2022-02-16T23:00:00.000Z,natesuits#4789,pat.zip (TE Academy)#5266,for awesome presentation of Introduction to Token Engineering yesterday! thanks for being so opened to share knowledge in an welcoming way!,8,13,0,0,,,6256d00b7d6ca6ad95bd5e04,,False,False,False,False,GideonRo#3175,Zeptimus#3359,enti#1546,Tam2140#9361,7,13
835,6256d00b7d6ca6ad95bd5e10,2022-02-16T23:00:00.000Z,natesuits#4789,enti#1546,for hosting this week's community call!,0,13,1,0,6256d00b7d6ca6ad95bd5e3b,,,,False,False,False,False,GideonRo#3175,Zeptimus#3359,enti#1546,Tam2140#9361,5,13
892,6256d00b7d6ca6ad95bd5e49,2022-02-18T23:00:00.000Z,chuygarcia.eth#6692,Mount Manu#3530,for all the trust you put on all the teams within Comm’s T.E.A.M.,13,3,5,0,,,,,False,False,False,False,bear100#9085,missgene#7773,acidlazzer#5796,Tam2140#9361,7,13
895,6256d00b7d6ca6ad95bd5e4c,2022-02-18T23:00:00.000Z,Juankbell#7458,Mount Manu#3530,for leading our first Gravity practice group last week,1,0,0,13,,6256d00b7d6ca6ad95bd5e3d,6256d00b7d6ca6ad95bd5e3d,,False,False,False,False,eduardovegap#0422,missgene#7773,Nuggan#5183,AmwFund#0979,4,13
899,6256d00b7d6ca6ad95bd5e50,2022-02-18T23:00:00.000Z,johnjonas#2307,Mount Manu#3530,for all your good work and contributions inside the animation & video production team,0,8,13,8,6256d00b7d6ca6ad95bd5cb7,,,,False,False,False,False,Mike Brunt#0745,Zeptimus#3359,divine_comedian#5493,AmwFund#0979,7,13
942,6256d00b7d6ca6ad95bd5e7b,2022-02-18T23:00:00.000Z,Mert Ozd#6679,Mount Manu#3530,for engaging in syncs and discussions and for their eagerness to contribute to the TEC,5,0,13,5,,,,,False,False,False,False,eduardovegap#0422,Usua◎ Silver#2618,divine_comedian#5493,innov8tor3#3988,7,13
1000,6256d00b7d6ca6ad95bd5eb5,2022-02-20T23:00:00.000Z,PhilH#1102,kristofer#1475,for adding their comments on the praise quantification process to the feedback doc. Your input is invaluable!,5,0,0,13,,6256d00b7d6ca6ad95bd5de6,6256d00b7d6ca6ad95bd5de6,,False,False,False,False,eduardovegap#0422,missgene#7773,Nuggan#5183,tigeroid#2951,4,13
1009,6256d00b7d6ca6ad95bd5ebe,2022-02-20T23:00:00.000Z,MarioRozo#3294,acidlazzer#5796,for translating the reward sytems video first rundown draft,0,13,5,8,,,,,False,False,False,False,osycross(🦎🦎)#5943,liviade#1387,acidlazzer#5796,tigeroid#2951,8,13
63,6256d00b7d6ca6ad95bd5b0c,2022-02-03T23:00:00.000Z,Tam2140#9361,freshelle#9882,for engaging in discussion on the TE Commons Forum (https://forum.tecommons.org) the past week. Thank you for helping our Token Engineering Commons community share and learn! 💪🙏,13,0,1,0,,,,,False,False,False,True,Mike Brunt#0745,Usua◎ Silver#2618,boonjue.eth#7124,tigeroid#2951,4,13
974,6256d00b7d6ca6ad95bd5e9b,2022-02-19T23:00:00.000Z,Zeptimus#3359,Mount Manu#3530,for all the work you’ve been doing in the Transparency WG,13,0,3,0,,,,6256d00b7d6ca6ad95bd5e0c,False,False,False,False,GideonRo#3175,Usua◎ Silver#2618,enti#1546,AmwFund#0979,5,13
1029,6256d00b7d6ca6ad95bd5ed2,2022-02-21T23:00:00.000Z,pat.zip (TE Academy)#5266,acidlazzer#5796,"for all the commitment and work they are doing at the TE Academy TEAM, good work ❤️",0,13,5,5,,,,,False,False,False,False,osycross(🦎🦎)#5943,Zeptimus#3359,acidlazzer#5796,EFRA#7972,7,13
955,6256d00b7d6ca6ad95bd5e88,2022-02-19T23:00:00.000Z,Tam2140#9361,Mount Manu#3530,for attending ETHDenver and doing presentations & panels about our work within the TEC,0,0,0,13,6256d00b7d6ca6ad95bd5d57,,6256d00b7d6ca6ad95bd5e37,,False,False,False,False,Mike Brunt#0745,Usua◎ Silver#2618,boonjue.eth#7124,tigeroid#2951,8,13
945,6256d00b7d6ca6ad95bd5e7e,2022-02-19T23:00:00.000Z,"griff (💜, 💜)#8888",enti#1546,"for this talk https://youtu.be/ADSOVkujrI4, I'm speechless, this is the reason I try my best to be useful to the space",0,8,13,8,,,,,False,False,False,False,osycross(🦎🦎)#5943,missgene#7773,Nuggan#5183,EFRA#7972,9,13
933,6256d00b7d6ca6ad95bd5e72,2022-02-18T23:00:00.000Z,eduardovegap#0422,Mount Manu#3530,for leading the weekly Onboarding Call and welcoming new members into our community,0,8,0,13,6256d00b7d6ca6ad95bd5bce,,6256d00b7d6ca6ad95bd5e6b,,False,False,False,False,Mike Brunt#0745,Zeptimus#3359,Nuggan#5183,tigeroid#2951,5,13
903,6256d00b7d6ca6ad95bd5e54,2022-02-18T23:00:00.000Z,Juankbell#7458,Mount Manu#3530,for all your help in Twitter planning and for your support behind the scenes,3,0,3,13,,6256d00b7d6ca6ad95bd5de5,,,False,False,False,False,eduardovegap#0422,missgene#7773,Nuggan#5183,AmwFund#0979,5,13
1054,6256d00b7d6ca6ad95bd5eeb,2022-02-22T23:00:00.000Z,Leen#8610,Jeremy&TheGospelOfChange#8201,"for checking out, heading to vipassana and showing that its cool to take care of yourself",13,0,5,5,,,,,False,False,False,False,Mike Brunt#0745,Usua◎ Silver#2618,enti#1546,EFRA#7972,7,13
926,6256d00b7d6ca6ad95bd5e6b,2022-02-18T23:00:00.000Z,eduardovegap#0422,Mount Manu#3530,for hosting a very welcoming onboarding session,0,13,5,8,6256d00b7d6ca6ad95bd5bce,,,,False,False,False,False,Mike Brunt#0745,Zeptimus#3359,Nuggan#5183,tigeroid#2951,6,13
1063,6256d00b7d6ca6ad95bd5ef4,2022-02-22T23:00:00.000Z,Letty#5399,solsista#5370,for being the brain of 0mega that never loses a good reference,5,0,1,13,,,,,False,False,False,False,eduardovegap#0422,Usua◎ Silver#2618,boonjue.eth#7124,tigeroid#2951,6,13
1065,6256d00b7d6ca6ad95bd5ef6,2022-02-22T23:00:00.000Z,solsista#5370,nic#9212,for facilitating today's session. Brought a few friends and they enjoyed your facilitation style v v much 💗,0,13,5,8,,,,,False,False,False,False,osycross(🦎🦎)#5943,Zeptimus#3359,acidlazzer#5796,EFRA#7972,8,13
1066,6256d00b7d6ca6ad95bd5ef7,2022-02-22T23:00:00.000Z,Letty#5399,nic#9212,for always flowing knowledge into 0mega,1,0,3,13,,,,,False,False,False,False,eduardovegap#0422,Usua◎ Silver#2618,boonjue.eth#7124,tigeroid#2951,5,13
1070,6256d00b7d6ca6ad95bd5efb,2022-02-22T23:00:00.000Z,Aemikorobinson#5961,nic#9212,for hopping into 0mega and bringing fresh energy into the group 🙏,1,0,3,13,,,,,False,False,False,False,eduardovegap#0422,Usua◎ Silver#2618,divine_comedian#5493,tigeroid#2951,5,13
1072,6256d00b7d6ca6ad95bd5efd,2022-02-22T23:00:00.000Z,MargaritaDave#8576,nic#9212,for hopping into 0mega and bringing fresh energy into the group 🙏,3,0,3,13,,,,,False,False,False,False,eduardovegap#0422,Usua◎ Silver#2618,boonjue.eth#7124,innov8tor3#3988,6,13
828,6256d00b7d6ca6ad95bd5e09,2022-02-15T23:00:00.000Z,eduardovegap#0422,bends#3537,for the discussion on metrics,8,0,5,13,,6256d00b7d6ca6ad95bd5e06,,,False,False,False,False,Mike Brunt#0745,Zeptimus#3359,Nuggan#5183,tigeroid#2951,6,13
823,6256d00b7d6ca6ad95bd5e04,2022-02-15T23:00:00.000Z,natesuits#4789,heater#9765,for presenting at the monthly TEA x TEC Intro to TE event,13,13,8,0,,,,,False,False,False,False,GideonRo#3175,Zeptimus#3359,enti#1546,Tam2140#9361,11,13
816,6256d00b7d6ca6ad95bd5dfd,2022-02-14T23:00:00.000Z,enti#1546,bends#3537,for sharing valuable feedback on the accessibility of information for newcomers,13,8,21,8,,,,,False,False,False,False,Mike Brunt#0745,liviade#1387,divine_comedian#5493,innov8tor3#3988,12,13
706,6256d00b7d6ca6ad95bd5d8f,2022-02-12T23:00:00.000Z,natesuits#4789,Mount Manu#3530,for the first steps to form the writer’s guild within our Commons,13,13,5,0,,,,,False,False,False,False,GideonRo#3175,Zeptimus#3359,enti#1546,Tam2140#9361,10,13
1160,6256d00b7d6ca6ad95bd5f55,2022-02-25T23:00:00.000Z,natesuits#4789,Mount Manu#3530,"for leading the TEC forward, both physically and virtually",13,13,3,0,,,,,False,False,False,False,GideonRo#3175,Zeptimus#3359,enti#1546,Tam2140#9361,9,13
721,6256d00b7d6ca6ad95bd5d9e,2022-02-12T23:00:00.000Z,Zeptimus#3359,Mount Manu#3530,"for always being in the meetings, giving valuable input, and, of course, for recording them",13,0,3,13,,,,,False,False,False,False,GideonRo#3175,Usua◎ Silver#2618,enti#1546,AmwFund#0979,9,13
127,6256d00b7d6ca6ad95bd5b4c,2022-02-08T23:00:00.000Z,elessar.eth#7945,Mount Manu#3530,for all the hard work that they put into the open source software that we build for the whole of web3,0,13,13,5,,,,,False,False,False,False,osycross(🦎🦎)#5943,lee0007#8152,boonjue.eth#7124,AmwFund#0979,10,13
714,6256d00b7d6ca6ad95bd5d97,2022-02-12T23:00:00.000Z,Nuggan#5183,Mount Manu#3530,for your participation in the proposal inverter,8,21,13,8,,,,,False,False,False,False,Mike Brunt#0745,liviade#1387,acidlazzer#5796,EFRA#7972,12,13
27,6256d00b7d6ca6ad95bd5ae8,2022-02-01T23:00:00.000Z,Zeptimus#3359,acidlazzer#5796,for working on the TEC dune analytics! It is looking pretty cool! 📈 🔥,5,0,0,13,,,6256d00b7d6ca6ad95bd5af4,,False,False,False,False,GideonRo#3175,Usua◎ Silver#2618,enti#1546,AmwFund#0979,6,13
708,6256d00b7d6ca6ad95bd5d91,2022-02-12T23:00:00.000Z,Tam2140#9361,Mount Manu#3530,for your guidance through confusing times: your leadership is irreplaceable for our community,0,0,1,13,6256d00b7d6ca6ad95bd5b83,,,,False,False,False,False,Mike Brunt#0745,Usua◎ Silver#2618,boonjue.eth#7124,tigeroid#2951,5,13
707,6256d00b7d6ca6ad95bd5d90,2022-02-12T23:00:00.000Z,GideonRo#3175,Mount Manu#3530,for the first steps to form the writer’s guild within our Commons,0,13,3,13,,,,,False,False,False,False,osycross(🦎🦎)#5943,Zeptimus#3359,boonjue.eth#7124,tigeroid#2951,9,13
705,6256d00b7d6ca6ad95bd5d8e,2022-02-12T23:00:00.000Z,pat.zip (TE Academy)#5266,Mount Manu#3530,for your guidance and feedback supporting the Comms T.E.A.M. DAO,0,13,5,5,,,,,False,False,False,False,osycross(🦎🦎)#5943,Zeptimus#3359,acidlazzer#5796,EFRA#7972,7,13
123,6256d00b7d6ca6ad95bd5b48,2022-02-08T23:00:00.000Z,sem  🐝#0161,Mount Manu#3530,for the groundbreaking work that they did to make what we launched possible,13,0,3,0,,,,,False,False,False,False,bear100#9085,Usua◎ Silver#2618,boonjue.eth#7124,Tam2140#9361,8,13
701,6256d00b7d6ca6ad95bd5d8a,2022-02-12T23:00:00.000Z,chuygarcia.eth#6692,Mount Manu#3530,for making an amazing Comms group,3,0,13,0,,6256d00b7d6ca6ad95bd5cb2,,,False,False,False,False,bear100#9085,missgene#7773,acidlazzer#5796,Tam2140#9361,6,13
1165,6256d00b7d6ca6ad95bd5f5a,2022-02-25T23:00:00.000Z,natesuits#4789,Mount Manu#3530,for being very participative in the calls this week and for carrying forward the discussion while other Stewards were attending ETHDenver,13,13,0,0,,,6256d00b7d6ca6ad95bd5e6d,,False,False,False,False,GideonRo#3175,Zeptimus#3359,enti#1546,Tam2140#9361,8,13
694,6256d00b7d6ca6ad95bd5d83,2022-02-12T23:00:00.000Z,BiancaGadelha#2667,Mount Manu#3530,for stepping up on your contributions to Gravity,0,13,5,13,,,,,False,False,False,False,osycross(🦎🦎)#5943,Zeptimus#3359,acidlazzer#5796,innov8tor3#3988,10,13
1166,6256d00b7d6ca6ad95bd5f5b,2022-02-25T23:00:00.000Z,eduardovegap#0422,Mount Manu#3530,for being very participative in the calls this week and for carrying forward the discussion while other Stewards were attending ETHDenver,0,13,0,5,6256d00b7d6ca6ad95bd5f44,,6256d00b7d6ca6ad95bd5f44,,False,False,False,False,Mike Brunt#0745,Zeptimus#3359,Nuggan#5183,tigeroid#2951,5,13
683,6256d00b7d6ca6ad95bd5d78,2022-02-12T23:00:00.000Z,Juankbell#7458,Mount Manu#3530,for stepping up in assuming Gravity coordination,13,0,3,0,,6256d00b7d6ca6ad95bd5b67,,6256d00b7d6ca6ad95bd5d61,False,False,False,False,eduardovegap#0422,missgene#7773,Nuggan#5183,AmwFund#0979,4,13
1169,6256d00b7d6ca6ad95bd5f5e,2022-02-25T23:00:00.000Z,Leen#8610,Mount Manu#3530,for being very participative in the calls this week and for carrying forward the discussion while other Stewards were attending ETHDenver,5,0,5,13,,,,,False,False,False,False,Mike Brunt#0745,Usua◎ Silver#2618,enti#1546,EFRA#7972,7,13
1171,6256d00b7d6ca6ad95bd5f60,2022-02-25T23:00:00.000Z,bends#3537,Mount Manu#3530,for being very participative in the calls this week and for carrying forward the discussion while other Stewards were attending ETHDenver,21,8,13,13,,,,,False,False,False,False,Mike Brunt#0745,missgene#7773,Nuggan#5183,AmwFund#0979,13,13
1159,6256d00b7d6ca6ad95bd5f54,2022-02-25T23:00:00.000Z,divine_comedian#5493,Mount Manu#3530,"for leading the TEC forward, both physically and virtually",0,8,8,13,,,,,False,False,False,False,osycross(🦎🦎)#5943,liviade#1387,Nuggan#5183,tigeroid#2951,9,13
734,6256d00b7d6ca6ad95bd5dab,2022-02-12T23:00:00.000Z,David (please DYOR...)#4116,Mount Manu#3530,"for your constancy in contributing to the TEC, despite other work sometimes getting in the way",13,0,8,5,,,,,False,False,False,False,Mike Brunt#0745,Usua◎ Silver#2618,divine_comedian#5493,EFRA#7972,8,13
815,6256d00b7d6ca6ad95bd5dfc,2022-02-14T23:00:00.000Z,Jeremy&TheGospelOfChange#8201,bends#3537,for leading the liberating structures practice group!,0,5,0,13,6256d00b7d6ca6ad95bd5e03,,6256d00b7d6ca6ad95bd5d7b,,False,False,False,False,GideonRo#3175,lee0007#8152,divine_comedian#5493,AmwFund#0979,5,13
