index,ID,DATE,TO USER ACCOUNT,FROM USER ACCOUNT,REASON,SCORE 1,SCORE 2,SCORE 3,SCORE 4,DUPLICATE ID 1,DUPLICATE ID 2,DUPLICATE ID 3,DUPLICATE ID 4,DISMISSED 1,DISMISSED 2,DISMISSED 3,DISMISSED 4,QUANTIFIER 1 USERNAME,QUANTIFIER 2 USERNAME,QUANTIFIER 3 USERNAME,QUANTIFIER 4 USERNAME,AVG SCORE,SPREAD
305,6256d00b7d6ca6ad95bd5bfe,2022-02-08T23:00:00.000Z,solsista#5370,Mount Manu#3530,for being our current Stewards and for offering guidance and support to anyone who approaches you,0,0,8,0,,6256d00b7d6ca6ad95bd5b74,,6256d00b7d6ca6ad95bd5b74,False,False,False,False,osycross(🦎🦎)#5943,Zeptimus#3359,acidlazzer#5796,EFRA#7972,4,8
468,6256d00b7d6ca6ad95bd5ca1,2022-02-08T23:00:00.000Z,T Wells#9070,Mount Manu#3530,for the great job in the 1Hive TV x TEC episode,8,0,8,0,,6256d00b7d6ca6ad95bd5c7a,,6256d00b7d6ca6ad95bd5c7a,False,False,False,False,eduardovegap#0422,missgene#7773,acidlazzer#5796,innov8tor3#3988,5,8
101,6256d00b7d6ca6ad95bd5b32,2022-02-07T23:00:00.000Z,PhilH#1102,Zeptimus#3359,for participating in the doodle for Praise insights and quantification feedback!,5,13,8,13,,,,,False,False,False,False,eduardovegap#0422,missgene#7773,Nuggan#5183,tigeroid#2951,9,8
212,6256d00b7d6ca6ad95bd5ba1,2022-02-08T23:00:00.000Z,akrtws (TE Academy)#4246,Mount Manu#3530,for leading the TE Academy,5,8,5,0,,,,6256d00b7d6ca6ad95bd5b79,False,False,False,False,GideonRo#3175,lee0007#8152,boonjue.eth#7124,innov8tor3#3988,5,8
1106,6256d00b7d6ca6ad95bd5f1f,2022-02-24T23:00:00.000Z,ALOYSIOUS#3049,freshelle#9882,for mentioning or retweeting TE Commons on the socials the past week! Thank you for helping us grow the Token Engineering Commons community and spreading the message! 🙏🏼,0,1,3,8,,,,,True,False,False,False,bear100#9085,missgene#7773,divine_comedian#5493,innov8tor3#3988,3,8
833,6256d00b7d6ca6ad95bd5e0e,2022-02-16T23:00:00.000Z,natesuits#4789,Ratio13#0578,for his continued passion for true transparency for continued support and assistance in the Transparency WG for his presentation at Intro to TE Academy for attending Transparency WG and after hours conversation.,8,5,5,0,,,,,False,False,False,False,GideonRo#3175,Zeptimus#3359,enti#1546,Tam2140#9361,6,8
461,6256d00b7d6ca6ad95bd5c9a,2022-02-08T23:00:00.000Z,durgadas#9280,Mount Manu#3530,for all the hard work behind the email newsletter,13,5,13,5,,,,,False,False,False,False,GideonRo#3175,lee0007#8152,acidlazzer#5796,EFRA#7972,9,8
180,6256d00b7d6ca6ad95bd5b81,2022-02-08T23:00:00.000Z,Mount Manu#3530,Mount Manu#3530,for helping Bustavo with some questions he had about the TEC,5,0,8,5,,,,,False,False,False,False,bear100#9085,lee0007#8152,divine_comedian#5493,AmwFund#0979,6,8
219,6256d00b7d6ca6ad95bd5ba8,2022-02-08T23:00:00.000Z,bends#3537,Mount Manu#3530,for sharing interesting topics in Gravity,13,5,8,5,,,,,False,False,False,False,Mike Brunt#0745,missgene#7773,Nuggan#5183,AmwFund#0979,7,8
1142,6256d00b7d6ca6ad95bd5f43,2022-02-25T23:00:00.000Z,Zeptimus#3359,Mount Manu#3530,for holding down the fort while all the other Stewards were in ETHDenver,8,0,5,0,,,,6256d00b7d6ca6ad95bd5f15,False,False,False,False,GideonRo#3175,Usua◎ Silver#2618,enti#1546,AmwFund#0979,4,8
744,6256d00b7d6ca6ad95bd5db5,2022-02-12T23:00:00.000Z,Nuggan#5183,Mount Manu#3530,for your engagement in the proposal inverter,0,0,8,0,6256d00b7d6ca6ad95bd5d97,6256d00b7d6ca6ad95bd5d97,,6256d00b7d6ca6ad95bd5d97,False,False,False,False,Mike Brunt#0745,liviade#1387,acidlazzer#5796,EFRA#7972,2,8
1001,6256d00b7d6ca6ad95bd5eb6,2022-02-20T23:00:00.000Z,Mettodo#7010,kristofer#1475,for adding their comments on the praise quantification process to the feedback doc. Your input is invaluable!,0,0,8,0,,6256d00b7d6ca6ad95bd5de7,,6256d00b7d6ca6ad95bd5de7,False,False,False,False,osycross(🦎🦎)#5943,liviade#1387,Nuggan#5183,innov8tor3#3988,3,8
347,6256d00b7d6ca6ad95bd5c28,2022-02-08T23:00:00.000Z,"griff (💜, 💜)#8888",Mount Manu#3530,for being our community's Stewards,0,0,8,0,,6256d00b7d6ca6ad95bd5b69,,6256d00b7d6ca6ad95bd5bf3,False,False,False,False,osycross(🦎🦎)#5943,missgene#7773,Nuggan#5183,EFRA#7972,3,8
748,6256d00b7d6ca6ad95bd5db9,2022-02-12T23:00:00.000Z,kristofer#1475,Mount Manu#3530,for the work your do in Praise Quantification,0,0,8,0,,6256d00b7d6ca6ad95bd5bbb,,,False,False,False,False,osycross(🦎🦎)#5943,missgene#7773,acidlazzer#5796,Tam2140#9361,4,8
218,6256d00b7d6ca6ad95bd5ba7,2022-02-08T23:00:00.000Z,mateodaza#3156,Mount Manu#3530,for being Juanka’s close friend and for working together on a lot of projects,5,0,8,3,,,,,False,False,False,False,eduardovegap#0422,Usua◎ Silver#2618,Nuggan#5183,EFRA#7972,5,8
500,6256d00b7d6ca6ad95bd5cc1,2022-02-08T23:00:00.000Z,alantv#0964,Mount Manu#3530,for the feedback they gave me on a CS video we’re producing,5,0,5,8,,,,,False,True,False,False,eduardovegap#0422,lee0007#8152,boonjue.eth#7124,tigeroid#2951,4,8
1090,6256d00b7d6ca6ad95bd5f0f,2022-02-23T23:00:00.000Z,"griff (💜, 💜)#8888",enti#1546,"for their participation on ETH Denver, @natesuits, and @Mount Manu for their great commitment to the community, leading calls and helping everyone around. Also for being wherever needed.",0,0,8,5,,6256d00b7d6ca6ad95bd5ed7,,,False,False,False,False,osycross(🦎🦎)#5943,missgene#7773,Nuggan#5183,EFRA#7972,5,8
756,6256d00b7d6ca6ad95bd5dc1,2022-02-12T23:00:00.000Z,"griff (💜, 💜)#8888",Mount Manu#3530,for kicking off the first TAO Voting decision,0,8,5,8,,,,,False,False,False,False,osycross(🦎🦎)#5943,missgene#7773,Nuggan#5183,EFRA#7972,7,8
119,6256d00b7d6ca6ad95bd5b44,2022-02-07T23:00:00.000Z,chuygarcia.eth#6692,GideonRo#3175,for bringing great collaborative juices and advice to a planning session for stepping up TEC Medium publishing.,8,8,8,0,,,,,False,False,False,False,bear100#9085,missgene#7773,acidlazzer#5796,Tam2140#9361,8,8
216,6256d00b7d6ca6ad95bd5ba5,2022-02-08T23:00:00.000Z,durgadas#9280,Mount Manu#3530,for being someone very mindful and sensitive that brings a lot of value to this community,13,5,5,8,,,,,False,False,False,False,GideonRo#3175,lee0007#8152,acidlazzer#5796,EFRA#7972,7,8
864,6256d00b7d6ca6ad95bd5e2d,2022-02-17T23:00:00.000Z,akrtws (TE Academy)#4246,freshelle#9882,for engaging in discussion on the TE Commons Forum (https://forum.tecommons.org) the past week. Thank you for helping our Token Engineering Commons community share and learn! 💪🙏,1,0,1,8,,,,,False,True,False,False,GideonRo#3175,lee0007#8152,boonjue.eth#7124,innov8tor3#3988,2,8
118,6256d00b7d6ca6ad95bd5b43,2022-02-07T23:00:00.000Z,liviade#1387,Suga#8514,"for her authenticity and genuine gracefulness in unexpected, difficult situations.",8,0,3,0,,,,,False,False,False,False,eduardovegap#0422,Usua◎ Silver#2618,enti#1546,Tam2140#9361,5,8
117,6256d00b7d6ca6ad95bd5b42,2022-02-07T23:00:00.000Z,Juankbell#7458,Jeremy&TheGospelOfChange#8201,for representing at yonder gitcoin space,5,13,8,8,,,,,False,False,False,False,eduardovegap#0422,missgene#7773,Nuggan#5183,AmwFund#0979,8,8
341,6256d00b7d6ca6ad95bd5c22,2022-02-08T23:00:00.000Z,kristofer#1475,Mount Manu#3530,for all the time and work you put into the Rewards Systems,0,0,8,0,,6256d00b7d6ca6ad95bd5bca,,,False,False,False,False,osycross(🦎🦎)#5943,missgene#7773,acidlazzer#5796,Tam2140#9361,4,8
116,6256d00b7d6ca6ad95bd5b41,2022-02-07T23:00:00.000Z,liviade#1387,Jeremy&TheGospelOfChange#8201,for singing a song of love that also lives in my heart at the conflict management panel hosted by bitcoin,8,0,5,0,,,,,False,False,False,False,eduardovegap#0422,Usua◎ Silver#2618,enti#1546,Tam2140#9361,6,8
46,6256d00b7d6ca6ad95bd5afb,2022-02-02T23:00:00.000Z,Sara Camargos#0205,BiancaGadelha#2667,for join both orientation call and community call this week and for being interested in being in this community,0,1,8,5,,,,,False,False,False,False,osycross(🦎🦎)#5943,lee0007#8152,divine_comedian#5493,EFRA#7972,4,8
766,6256d00b7d6ca6ad95bd5dcb,2022-02-12T23:00:00.000Z,Tam2140#9361,Mount Manu#3530,for managing lots of different situations with tact and skill,0,0,3,8,6256d00b7d6ca6ad95bd5b83,,,,False,False,False,False,Mike Brunt#0745,Usua◎ Silver#2618,boonjue.eth#7124,tigeroid#2951,4,8
339,6256d00b7d6ca6ad95bd5c20,2022-02-08T23:00:00.000Z,JessicaZartler#2263,Mount Manu#3530,for being with the TEC since the beginning,13,8,5,13,,,,,False,False,False,False,GideonRo#3175,liviade#1387,acidlazzer#5796,tigeroid#2951,9,8
769,6256d00b7d6ca6ad95bd5dce,2022-02-12T23:00:00.000Z,"griff (💜, 💜)#8888",Mount Manu#3530,for managing lots of different situations with tact and skill,0,5,8,3,,,,,False,False,False,False,osycross(🦎🦎)#5943,missgene#7773,Nuggan#5183,EFRA#7972,5,8
458,6256d00b7d6ca6ad95bd5c97,2022-02-08T23:00:00.000Z,divine_comedian#5493,Mount Manu#3530,for approaching T.E.A.M.s with the proposal inverter,0,8,5,8,,,,,False,False,False,False,osycross(🦎🦎)#5943,liviade#1387,Nuggan#5183,tigeroid#2951,7,8
32,6256d00b7d6ca6ad95bd5aed,2022-02-01T23:00:00.000Z,chuygarcia.eth#6692,°⫰#2495,for adding the praise role for me so others in the community can receive praise,3,8,5,0,,,,,False,False,False,False,bear100#9085,missgene#7773,acidlazzer#5796,Tam2140#9361,5,8
296,6256d00b7d6ca6ad95bd5bf5,2022-02-08T23:00:00.000Z,chuygarcia.eth#6692,Mount Manu#3530,for being our current Stewards and for offering guidance and support to anyone who approaches you,0,3,8,0,,,,,True,False,False,False,bear100#9085,missgene#7773,acidlazzer#5796,Tam2140#9361,3,8
479,6256d00b7d6ca6ad95bd5cac,2022-02-08T23:00:00.000Z,Juankbell#7458,Mount Manu#3530,for improvements on your leadership skills,8,0,5,5,,6256d00b7d6ca6ad95bd5c0e,,,False,False,False,False,eduardovegap#0422,missgene#7773,Nuggan#5183,AmwFund#0979,4,8
1143,6256d00b7d6ca6ad95bd5f44,2022-02-25T23:00:00.000Z,eduardovegap#0422,Mount Manu#3530,for holding down the fort while all the other Stewards were in ETHDenver,13,13,21,13,,,,,False,False,False,False,Mike Brunt#0745,Zeptimus#3359,Nuggan#5183,tigeroid#2951,15,8
297,6256d00b7d6ca6ad95bd5bf6,2022-02-08T23:00:00.000Z,Zeptimus#3359,Mount Manu#3530,for being our current Stewards and for offering guidance and support to anyone who approaches you,8,0,3,5,,,,,False,False,False,False,GideonRo#3175,Usua◎ Silver#2618,enti#1546,AmwFund#0979,5,8
166,6256d00b7d6ca6ad95bd5b73,2022-02-08T23:00:00.000Z,natesuits#4789,Mount Manu#3530,for your work and commitment as Stewards,8,8,5,0,,,,,False,False,False,False,GideonRo#3175,Zeptimus#3359,enti#1546,Tam2140#9361,7,8
103,6256d00b7d6ca6ad95bd5b34,2022-02-07T23:00:00.000Z,eduardovegap#0422,akrtws (TE Academy)#4246,for sharing TEC onboarding activities and discussing with us how to best guide TE Fundamentals students to become active community members at TEA & TEC!,13,13,5,13,,,,,False,False,False,False,Mike Brunt#0745,Zeptimus#3359,Nuggan#5183,tigeroid#2951,11,8
78,6256d00b7d6ca6ad95bd5b1b,2022-02-06T23:00:00.000Z,Ratio13#0578,Zeptimus#3359,for joining transparency call update documentation share feedback on dune and weekly hours 😄,0,0,8,0,,,,,False,False,False,False,osycross(🦎🦎)#5943,Zeptimus#3359,divine_comedian#5493,Tam2140#9361,8,8
257,6256d00b7d6ca6ad95bd5bce,2022-02-08T23:00:00.000Z,eduardovegap#0422,Mount Manu#3530,for a very inviting intro done through the weekly onboarding call,8,13,5,8,,,,,False,False,False,False,Mike Brunt#0745,Zeptimus#3359,Nuggan#5183,tigeroid#2951,8,8
1297,6256d00b7d6ca6ad95bd5fde,2022-02-26T23:00:00.000Z,Mount Manu#3530,Mount Manu#3530,for all the energy you guys put into the TEC Orientation meeting,5,8,13,5,,,,,False,False,False,False,bear100#9085,lee0007#8152,divine_comedian#5493,AmwFund#0979,7,8
604,6256d00b7d6ca6ad95bd5d29,2022-02-09T23:00:00.000Z,mateodaza#3156,kristofer#1475,for working on the source cred configuration,3,0,8,8,,,,,False,False,False,False,eduardovegap#0422,Usua◎ Silver#2618,Nuggan#5183,EFRA#7972,6,8
1028,6256d00b7d6ca6ad95bd5ed1,2022-02-21T23:00:00.000Z,angieberryberry#9822,acidlazzer#5796,"for all the commitment and work they are doing at the TE Academy TEAM, good work ❤️",0,3,8,0,,,,6256d00b7d6ca6ad95bd5ee4,False,False,False,False,osycross(🦎🦎)#5943,lee0007#8152,enti#1546,innov8tor3#3988,4,8
156,6256d00b7d6ca6ad95bd5b69,2022-02-08T23:00:00.000Z,"griff (💜, 💜)#8888",Mount Manu#3530,for your work and commitment as Stewards,0,8,8,0,,,,6256d00b7d6ca6ad95bd5bf3,False,False,False,False,osycross(🦎🦎)#5943,missgene#7773,Nuggan#5183,EFRA#7972,6,8
154,6256d00b7d6ca6ad95bd5b67,2022-02-08T23:00:00.000Z,Juankbell#7458,Mount Manu#3530,for your leadership in Gravity and for taking the time to have a 1-on-1 with Bends this week,5,13,8,13,,,,,False,False,False,False,eduardovegap#0422,missgene#7773,Nuggan#5183,AmwFund#0979,9,8
609,6256d00b7d6ca6ad95bd5d2e,2022-02-09T23:00:00.000Z,MS#4235,kristofer#1475,for doing a great initial analysis of the anomalies in the old praise data.,8,13,8,5,,,,,False,False,False,False,eduardovegap#0422,missgene#7773,enti#1546,tigeroid#2951,8,8
1299,6256d00b7d6ca6ad95bd5fe0,2022-02-26T23:00:00.000Z,natesuits#4789,Mount Manu#3530,for accepting to be the voiceover for the 1st Rewards System video,8,8,3,0,,,,,False,False,False,False,GideonRo#3175,Zeptimus#3359,enti#1546,Tam2140#9361,6,8
939,6256d00b7d6ca6ad95bd5e78,2022-02-18T23:00:00.000Z,Juankbell#7458,Mount Manu#3530,for keeping the Stewards fort on-call while the other Stewards are networking in Denver,5,5,5,13,,,,,False,False,False,False,eduardovegap#0422,missgene#7773,Nuggan#5183,AmwFund#0979,7,8
614,6256d00b7d6ca6ad95bd5d33,2022-02-09T23:00:00.000Z,pat.zip (TE Academy)#5266,sidcode#1729,for keeping me constantly updated about the rewards research course in this extremely busy month for me,0,8,5,5,,,,,False,False,False,False,osycross(🦎🦎)#5943,Zeptimus#3359,acidlazzer#5796,EFRA#7972,6,8
548,6256d00b7d6ca6ad95bd5cf1,2022-02-09T23:00:00.000Z,eduardovegap#0422,Rohit Malekar#7021,for a warm welcome and an amazing orientation session yesterday!,8,13,5,5,,,,,False,False,False,False,Mike Brunt#0745,Zeptimus#3359,Nuggan#5183,tigeroid#2951,7,8
1051,6256d00b7d6ca6ad95bd5ee8,2022-02-22T23:00:00.000Z,BiancaGadelha#2667,Jeremy&TheGospelOfChange#8201,for also joining the Liberating Structures & Deep Democracy practice group!,0,1,8,1,,,,,False,False,False,False,osycross(🦎🦎)#5943,Zeptimus#3359,acidlazzer#5796,innov8tor3#3988,3,8
253,6256d00b7d6ca6ad95bd5bca,2022-02-08T23:00:00.000Z,kristofer#1475,Mount Manu#3530,for their contributions to the Rewards System WG,0,8,5,0,,,,,False,False,False,False,osycross(🦎🦎)#5943,missgene#7773,acidlazzer#5796,Tam2140#9361,6,8
1377,6256d00b7d6ca6ad95bd602e,2022-02-27T23:00:00.000Z,acidlazzer#5796,acidlazzer#5796,for attending the twitter planning weekly sync and always be supportive and helpful,5,1,8,0,,,,6256d00b7d6ca6ad95bd5f63,False,False,False,False,GideonRo#3175,Zeptimus#3359,divine_comedian#5493,innov8tor3#3988,3,8
1196,6256d00b7d6ca6ad95bd5f79,2022-02-25T23:00:00.000Z,chuygarcia.eth#6692,Mount Manu#3530,for being on the animation & video production T.E.A.M.,3,8,5,0,,,,,False,False,False,False,bear100#9085,missgene#7773,acidlazzer#5796,Tam2140#9361,5,8
626,6256d00b7d6ca6ad95bd5d3f,2022-02-10T23:00:00.000Z,missgene#7773,freshelle#9882,for mentioning or retweeting TE Commons on the socials the past week! Thank you for helping us grow the Token Engineering Commons community and spreading the message! 🙏🏼,0,1,1,8,,,,,False,False,False,False,osycross(🦎🦎)#5943,lee0007#8152,boonjue.eth#7124,innov8tor3#3988,3,8
972,6256d00b7d6ca6ad95bd5e99,2022-02-19T23:00:00.000Z,durgadas#9280,Mount Manu#3530,for constantly challenging this community and introducing Liberating Structures,0,3,8,0,6256d00b7d6ca6ad95bd5e11,,,6256d00b7d6ca6ad95bd5e11,False,False,False,False,GideonRo#3175,lee0007#8152,acidlazzer#5796,EFRA#7972,3,8
628,6256d00b7d6ca6ad95bd5d41,2022-02-10T23:00:00.000Z,akrtws (TE Academy)#4246,freshelle#9882,for engaging in discussion on the TE Commons Forum (https://forum.tecommons.org) the past week. Thank you for helping our Token Engineering Commons community share and learn! 💪🙏,3,0,1,8,,,,,False,True,False,False,GideonRo#3175,lee0007#8152,boonjue.eth#7124,innov8tor3#3988,3,8
630,6256d00b7d6ca6ad95bd5d43,2022-02-10T23:00:00.000Z,Tam2140#9361,freshelle#9882,for engaging in discussion on the TE Commons Forum (https://forum.tecommons.org) the past week. Thank you for helping our Token Engineering Commons community share and learn! 💪🙏,8,0,3,0,,,,,False,False,False,True,Mike Brunt#0745,Usua◎ Silver#2618,boonjue.eth#7124,tigeroid#2951,3,8
631,6256d00b7d6ca6ad95bd5d44,2022-02-10T23:00:00.000Z,acidlazzer#5796,freshelle#9882,for engaging in discussion on the TE Commons Forum (https://forum.tecommons.org) the past week. Thank you for helping our Token Engineering Commons community share and learn! 💪🙏,1,1,0,8,,,,,False,False,True,False,GideonRo#3175,Zeptimus#3359,divine_comedian#5493,innov8tor3#3988,2,8
599,6256d00b7d6ca6ad95bd5d24,2022-02-09T23:00:00.000Z,kristofer#1475,Zeptimus#3359,for sharing feedback and participating in the Praise insights and quantification feedback call,0,8,8,0,,,,,False,False,False,False,osycross(🦎🦎)#5943,missgene#7773,acidlazzer#5796,Tam2140#9361,8,8
943,6256d00b7d6ca6ad95bd5e7c,2022-02-18T23:00:00.000Z,Ratio13#0578,Mount Manu#3530,for engaging in syncs and discussions and for their eagerness to contribute to the TEC,0,8,3,0,,,,,False,False,False,False,osycross(🦎🦎)#5943,Zeptimus#3359,divine_comedian#5493,Tam2140#9361,5,8
414,6256d00b7d6ca6ad95bd5c6b,2022-02-08T23:00:00.000Z,"griff (💜, 💜)#8888",iviangita#3204,for joining the last Legal WG sync call and providing feedback on the Legal WG funding proposal and CV Proposal T&Cs,0,8,1,5,,,,,False,False,False,False,osycross(🦎🦎)#5943,missgene#7773,Nuggan#5183,EFRA#7972,4,8
432,6256d00b7d6ca6ad95bd5c7d,2022-02-08T23:00:00.000Z,sem  🐝#0161,Mount Manu#3530,for getting into the Hackathon where we hope to expand Celeste capabilities,8,0,3,0,,,,,False,False,False,False,bear100#9085,Usua◎ Silver#2618,boonjue.eth#7124,Tam2140#9361,5,8
566,6256d00b7d6ca6ad95bd5d03,2022-02-09T23:00:00.000Z,Zeptimus#3359,liviade#1387,for constant progress on the reward system's!,8,0,3,8,,,,,False,False,False,False,GideonRo#3175,Usua◎ Silver#2618,enti#1546,AmwFund#0979,6,8
59,6256d00b7d6ca6ad95bd5b08,2022-02-03T23:00:00.000Z,Mert Ozd#6679,freshelle#9882,for mentioning or retweeting TE Commons on the socials the past week! Thank you for helping us grow the Token Engineering Commons community and spreading the message! 🙏🏼,1,0,3,8,,,,,False,False,False,False,eduardovegap#0422,Usua◎ Silver#2618,divine_comedian#5493,innov8tor3#3988,4,8
2,6256d00b7d6ca6ad95bd5acf,2022-01-31T23:00:00.000Z,Leen#8610,Juankbell#7458,for their active contribution and engagement on the development of Gravity,8,0,3,5,,,,,False,False,False,False,Mike Brunt#0745,Usua◎ Silver#2618,enti#1546,EFRA#7972,5,8
563,6256d00b7d6ca6ad95bd5d00,2022-02-09T23:00:00.000Z,mateodaza#3156,liviade#1387,for constant progress on the reward system's!,1,0,8,0,,,,6256d00b7d6ca6ad95bd5c8f,False,False,False,False,eduardovegap#0422,Usua◎ Silver#2618,Nuggan#5183,EFRA#7972,3,8
1233,6256d00b7d6ca6ad95bd5f9e,2022-02-25T23:00:00.000Z,acidlazzer#5796,Mount Manu#3530,for all of the efforts around Comms,13,8,5,5,,,,,False,False,False,False,GideonRo#3175,Zeptimus#3359,divine_comedian#5493,innov8tor3#3988,7,8
185,6256d00b7d6ca6ad95bd5b86,2022-02-08T23:00:00.000Z,"griff (💜, 💜)#8888",Mount Manu#3530,for incessant forward momentum and for all the we all learn from you,0,8,8,8,,,,,False,False,False,False,osycross(🦎🦎)#5943,missgene#7773,Nuggan#5183,EFRA#7972,8,8
519,6256d00b7d6ca6ad95bd5cd4,2022-02-09T23:00:00.000Z,Ratio13#0578,Mount Manu#3530,for getting more involved with the TEC,0,8,5,0,,,,,False,False,False,False,osycross(🦎🦎)#5943,Zeptimus#3359,divine_comedian#5493,Tam2140#9361,6,8
449,6256d00b7d6ca6ad95bd5c8e,2022-02-08T23:00:00.000Z,kristofer#1475,Mount Manu#3530,for the last session that you had with Lívia regarding SourceCred and for the progress of the Rewards System WG,0,8,8,0,,,,,False,False,False,False,osycross(🦎🦎)#5943,missgene#7773,acidlazzer#5796,Tam2140#9361,8,8
1042,6256d00b7d6ca6ad95bd5edf,2022-02-22T23:00:00.000Z,MorganicMovement 🍄#1085,Jeremy&TheGospelOfChange#8201,for joining the Liberating Structures and Deep Democracy practice group sessions,3,3,8,0,,,,,False,False,False,False,Mike Brunt#0745,lee0007#8152,acidlazzer#5796,Tam2140#9361,4,8
435,6256d00b7d6ca6ad95bd5c80,2022-02-08T23:00:00.000Z,natesuits#4789,Mount Manu#3530,for agreeing to be on the Communitas multi-sig,8,3,3,0,,,,,False,False,False,False,GideonRo#3175,Zeptimus#3359,enti#1546,Tam2140#9361,4,8
450,6256d00b7d6ca6ad95bd5c8f,2022-02-08T23:00:00.000Z,mateodaza#3156,Mount Manu#3530,for the last session that you had with Lívia regarding SourceCred and for the progress of the Rewards System WG,5,0,8,8,,,,,False,False,False,False,eduardovegap#0422,Usua◎ Silver#2618,Nuggan#5183,EFRA#7972,7,8
1228,6256d00b7d6ca6ad95bd5f99,2022-02-25T23:00:00.000Z,Juankbell#7458,Mount Manu#3530,"for staying in and taking care of business while others went to ETHDenver (to also take care of business, but differently)",8,1,0,0,,,6256d00b7d6ca6ad95bd5f6f,6256d00b7d6ca6ad95bd5f6f,False,False,False,False,eduardovegap#0422,missgene#7773,Nuggan#5183,AmwFund#0979,2,8
1224,6256d00b7d6ca6ad95bd5f95,2022-02-25T23:00:00.000Z,Tam2140#9361,Mount Manu#3530,for your amazing talks at ETHDenver,0,0,5,8,6256d00b7d6ca6ad95bd5d57,,,,False,False,False,False,Mike Brunt#0745,Usua◎ Silver#2618,boonjue.eth#7124,tigeroid#2951,5,8
1223,6256d00b7d6ca6ad95bd5f94,2022-02-25T23:00:00.000Z,Juankbell#7458,Mount Manu#3530,for all your support on Twitter planning,1,0,1,8,,6256d00b7d6ca6ad95bd5ebf,,,False,False,False,False,eduardovegap#0422,missgene#7773,Nuggan#5183,AmwFund#0979,2,8
949,6256d00b7d6ca6ad95bd5e82,2022-02-19T23:00:00.000Z,durgadas#9280,solsista#5370,for his input on facilitation techniques to shape our interactive sessions,8,5,5,13,,,,,False,False,False,False,GideonRo#3175,lee0007#8152,acidlazzer#5796,EFRA#7972,7,8
21,6256d00b7d6ca6ad95bd5ae2,2022-02-01T23:00:00.000Z,kristofer#1475,mateodaza#3156,for joining a hack session on the pollen bot today,0,8,5,0,,,,,False,False,False,False,osycross(🦎🦎)#5943,missgene#7773,acidlazzer#5796,Tam2140#9361,6,8
947,6256d00b7d6ca6ad95bd5e80,2022-02-19T23:00:00.000Z,Jolly LaMa#5962,solsista#5370,for nudging 0mega regulars to welcome newcomers with a curious inquiry as where they come from and what they might be looking for,5,13,5,8,,,,,False,False,False,False,bear100#9085,missgene#7773,acidlazzer#5796,EFRA#7972,7,8
555,6256d00b7d6ca6ad95bd5cf8,2022-02-09T23:00:00.000Z,Loie#2921,liviade#1387,for creating a wonderful space for us to share about our conflict resolution experiences and meet peers in the space,5,0,5,8,,,,,False,False,False,False,eduardovegap#0422,Usua◎ Silver#2618,enti#1546,AmwFund#0979,6,8
149,6256d00b7d6ca6ad95bd5b62,2022-02-08T23:00:00.000Z,danielo#2815,Mount Manu#3530,for thoughts on alternative processes for onboarding more advanced contributors,3,5,8,0,,,,,False,False,False,False,eduardovegap#0422,missgene#7773,divine_comedian#5493,Tam2140#9361,5,8
1033,6256d00b7d6ca6ad95bd5ed6,2022-02-22T23:00:00.000Z,Leen#8610,Jeremy&TheGospelOfChange#8201,for hosting the DD/LS practice space,8,0,0,0,,,6256d00b7d6ca6ad95bd5f06,6256d00b7d6ca6ad95bd5f06,False,False,False,False,Mike Brunt#0745,Usua◎ Silver#2618,enti#1546,EFRA#7972,3,8
1187,6256d00b7d6ca6ad95bd5f70,2022-02-25T23:00:00.000Z,eduardovegap#0422,Mount Manu#3530,for stepping up and facilitating in absence of all the other Stewards,0,0,0,8,6256d00b7d6ca6ad95bd5f44,6256d00b7d6ca6ad95bd5f5b,6256d00b7d6ca6ad95bd5f44,,False,False,False,False,Mike Brunt#0745,Zeptimus#3359,Nuggan#5183,tigeroid#2951,3,8
1270,6256d00b7d6ca6ad95bd5fc3,2022-02-25T23:00:00.000Z,bends#3537,Mount Manu#3530,"for engaging with the TEC, despite being relative newcomers",8,0,5,5,,6256d00b7d6ca6ad95bd5fae,,,False,False,False,False,Mike Brunt#0745,missgene#7773,Nuggan#5183,AmwFund#0979,4,8
975,6256d00b7d6ca6ad95bd5e9c,2022-02-19T23:00:00.000Z,eduardovegap#0422,Mount Manu#3530,for your leadership within the onboarding efforts of Communitas,0,8,5,8,6256d00b7d6ca6ad95bd5b60,,,,False,False,False,False,Mike Brunt#0745,Zeptimus#3359,Nuggan#5183,tigeroid#2951,5,8
307,6256d00b7d6ca6ad95bd5c00,2022-02-08T23:00:00.000Z,akrtws (TE Academy)#4246,Mount Manu#3530,for being TE thought leaders and for having given the TEC their support,8,5,3,0,,,,6256d00b7d6ca6ad95bd5b79,False,False,False,False,GideonRo#3175,lee0007#8152,boonjue.eth#7124,innov8tor3#3988,5,8
1279,6256d00b7d6ca6ad95bd5fcc,2022-02-25T23:00:00.000Z,Vyvy-vi#5040,Mount Manu#3530,for meeting with mattyjee and for helping him get incorporated into the Praise project,0,0,0,8,6256d00b7d6ca6ad95bd5c65,6256d00b7d6ca6ad95bd5c65,6256d00b7d6ca6ad95bd5c65,,False,False,False,False,GideonRo#3175,liviade#1387,Nuggan#5183,EFRA#7972,2,8
1307,6256d00b7d6ca6ad95bd5fe8,2022-02-26T23:00:00.000Z,eduardovegap#0422,Mount Manu#3530,for hosting our Orientation call this past week,0,8,0,0,6256d00b7d6ca6ad95bd5b60,,6256d00b7d6ca6ad95bd5fbb,,False,False,False,True,Mike Brunt#0745,Zeptimus#3359,Nuggan#5183,tigeroid#2951,2,8
916,6256d00b7d6ca6ad95bd5e61,2022-02-18T23:00:00.000Z,durgadas#9280,Mount Manu#3530,"for stepping up in activities in Gravity and helping with so many things (i.e. developing a website, leading practice groups, and starting a research)",13,13,5,13,,,,,False,False,False,False,GideonRo#3175,lee0007#8152,acidlazzer#5796,EFRA#7972,11,8
138,6256d00b7d6ca6ad95bd5b57,2022-02-08T23:00:00.000Z,Zeptimus#3359,Mount Manu#3530,for coming forward to improve our DAO2DAO transparency,5,0,5,8,,,,,False,False,False,False,GideonRo#3175,Usua◎ Silver#2618,enti#1546,AmwFund#0979,6,8
442,6256d00b7d6ca6ad95bd5c87,2022-02-08T23:00:00.000Z,sidcode#1729,Mount Manu#3530,for being an amazing connector and for weaving contributors between SuperStars and the TEC,13,21,13,13,,,,,False,False,False,False,bear100#9085,Zeptimus#3359,Nuggan#5183,tigeroid#2951,15,8
